source_url,title,authors,abstract_url,pdf_url
https://arxiv.org/list/cs.LG/recent,Equivariance by Contrast: Identifiable Equivariant Embeddings from Unlabeled Finite Group Actions,"Tobias Schmidt, Steffen Schneider, Matthias Bethge",https://arxiv.org/abs/2510.21706,https://arxiv.org/pdf/2510.21706
https://arxiv.org/list/cs.LG/recent,Mechanistic Interpretability for Neural TSP Solvers,"Reuben Narad, Leonard Boussioux, Michael Wagner",https://arxiv.org/abs/2510.21693,https://arxiv.org/pdf/2510.21693
https://arxiv.org/list/cs.LG/recent,On Uncertainty Calibration for Equivariant Functions,"Edward Berman, Jacob Ginesin, Marco Pacini, Robin Walters",https://arxiv.org/abs/2510.21691,https://arxiv.org/pdf/2510.21691
https://arxiv.org/list/cs.LG/recent,Optimal Graph Clustering without Edge Density Signals,"Maximilien Dreveton, Elaine Siyu Liu, Matthias Grossglauser, Patrick Thiran",https://arxiv.org/abs/2510.21669,https://arxiv.org/pdf/2510.21669
https://arxiv.org/list/cs.LG/recent,DEEDEE: Fast and Scalable Out-of-Distribution Dynamics Detection,"Tala Aljaafari, Varun Kanade, Philip Torr, Christian Schroeder de Witt",https://arxiv.org/abs/2510.21638,https://arxiv.org/pdf/2510.21638
https://arxiv.org/list/cs.LG/recent,Few-Shot Knowledge Distillation of LLMs With Counterfactual Explanations,"Faisal Hamman, Pasan Dissanayake, Yanjun Fu, Sanghamitra Dutta",https://arxiv.org/abs/2510.21631,https://arxiv.org/pdf/2510.21631
https://arxiv.org/list/cs.LG/recent,Generative Correlation Manifolds: Generating Synthetic Data with Preserved Higher-Order Correlations,"Jens E. d'Hondt, Wieger R. Punter, Odysseas Papapetrou",https://arxiv.org/abs/2510.21610,https://arxiv.org/pdf/2510.21610
https://arxiv.org/list/cs.LG/recent,Generalised Flow Maps for Few-Step Generative Modelling on Riemannian Manifolds,"Oscar Davis, Michael S. Albergo, Nicholas M. Boffi, Michael M. Bronstein, Avishek Joey Bose",https://arxiv.org/abs/2510.21608,https://arxiv.org/pdf/2510.21608
https://arxiv.org/list/cs.LG/recent,SHAP Meets Tensor Networks: Provably Tractable Explanations with Parallelism,"Reda Marzouk, Shahaf Bassan, Guy Katz",https://arxiv.org/abs/2510.21599,https://arxiv.org/pdf/2510.21599
https://arxiv.org/list/cs.LG/recent,Accelerating Data Generation for Nonlinear temporal PDEs via homologous perturbation in solution space,"Lei Liu, Zhenxin Huang, Hong Wang, huanshuo dong, Haiyang Xin, Hongwei Zhao, Bin Li",https://arxiv.org/abs/2510.21592,https://arxiv.org/pdf/2510.21592
https://arxiv.org/list/cs.LG/recent,"REVE: A Foundation Model for EEG -- Adapting to Any Setup with Large-Scale Pretraining on 25,000 Subjects","Yassine El Ouahidi, Jonathan Lys, Philipp Thölke, Nicolas Farrugia, Bastien Pasdeloup, Vincent Gripon, Karim Jerbi, Giulia Lioi",https://arxiv.org/abs/2510.21585,https://arxiv.org/pdf/2510.21585
https://arxiv.org/list/cs.LG/recent,An unsupervised tour through the hidden pathways of deep neural networks,Diego Doimo,https://arxiv.org/abs/2510.21582,https://arxiv.org/pdf/2510.21582
https://arxiv.org/list/cs.LG/recent,Leveraging Classical Algorithms for Graph Neural Networks,"Jason Wu, Petar Veličković",https://arxiv.org/abs/2510.21574,https://arxiv.org/pdf/2510.21574
https://arxiv.org/list/cs.LG/recent,Interpretable Multimodal Zero-Shot ECG Diagnosis via Structured Clinical Knowledge Alignment,"Jialu Tang, Hung Manh Pham, Ignace De Lathauwer, Henk S. Schipper, Yuan Lu, Dong Ma, Aaqib Saeed",https://arxiv.org/abs/2510.21551,https://arxiv.org/pdf/2510.21551
https://arxiv.org/list/cs.LG/recent,Cost Minimization for Space-Air-Ground Integrated Multi-Access Edge Computing Systems,"Weihong Qin, Aimin Wang, Geng Sun, Zemin Sun, Jiacheng Wang, Dusit Niyato, Dong In Kim, Zhu Han",https://arxiv.org/abs/2510.21541,https://arxiv.org/pdf/2510.21541
https://arxiv.org/list/cs.LG/recent,Excision Score: Evaluating Edits with Surgical Precision,"Nikolai Gruzinov, Ksenia Sycheva, Earl T. Barr, Alex Bezzubov",https://arxiv.org/abs/2510.21537,https://arxiv.org/pdf/2510.21537
https://arxiv.org/list/cs.LG/recent,FrameShield: Adversarially Robust Video Anomaly Detection,"Mojtaba Nafez, Mobina Poulaei, Nikan Vasei, Bardia Soltani Moakhar, Mohammad Sabokrou, MohammadHossein Rohban",https://arxiv.org/abs/2510.21532,https://arxiv.org/pdf/2510.21532
https://arxiv.org/list/cs.LG/recent,Probe-based Fine-tuning for Reducing Toxicity,"Jan Wehner, Mario Fritz",https://arxiv.org/abs/2510.21531,https://arxiv.org/pdf/2510.21531
https://arxiv.org/list/cs.LG/recent,A Unified Model for Multi-Task Drone Routing in Post-Disaster Road Assessment,"Huatian Gong, Jiuh-Biing Sheu, Zheng Wang, Xiaoguang Yang, Ran Yan",https://arxiv.org/abs/2510.21525,https://arxiv.org/pdf/2510.21525
https://arxiv.org/list/cs.LG/recent,Surrogate-based quantification of policy uncertainty in generative flow networks,"Ramón Nartallo-Kaluarachchi, Robert Manson-Sawko, Shashanka Ubaru, Dongsung Huh, Małgorzata J Zimoń, Lior Horesh, Yoshua Bengio",https://arxiv.org/abs/2510.21523,https://arxiv.org/pdf/2510.21523
https://arxiv.org/list/cs.LG/recent,Uniform Convergence Beyond Glivenko-Cantelli,"Tanmay Devale, Pramith Devulapalli, Steve Hanneke",https://arxiv.org/abs/2510.21506,https://arxiv.org/pdf/2510.21506
https://arxiv.org/list/cs.LG/recent,Benchmarking Catastrophic Forgetting Mitigation Methods in Federated Time Series Forecasting,"Khaled Hallak, Oudom Kem",https://arxiv.org/abs/2510.21491,https://arxiv.org/pdf/2510.21491
https://arxiv.org/list/cs.LG/recent,Parameter-Free Hypergraph Neural Network for Few-Shot Node Classification,"Chaewoon Bae, Doyun Choi, Jaehyun Lee, Jaemin Yoo",https://arxiv.org/abs/2510.21462,https://arxiv.org/pdf/2510.21462
https://arxiv.org/list/cs.LG/recent,Estimating Treatment Effects in Networks using Domain Adversarial Training,"Daan Caljon, Jente Van Belle, Wouter Verbeke",https://arxiv.org/abs/2510.21457,https://arxiv.org/pdf/2510.21457
https://arxiv.org/list/cs.LG/recent,Towards Explainable Personalized Recommendations by Learning from Users' Photos,"Jorge Díez, Pablo Pérez-Núñez, Oscar Luaces, Beatriz Remeseiro, Antonio Bahamonde",https://arxiv.org/abs/2510.21455,https://arxiv.org/pdf/2510.21455
https://arxiv.org/list/cs.LG/recent,ParaRNN: Unlocking Parallel Training of Nonlinear RNNs for Large Language Models,"Federico Danieli, Pau Rodriguez, Miguel Sarabia, Xavier Suau, Luca Zappella",https://arxiv.org/abs/2510.21450,https://arxiv.org/pdf/2510.21450
https://arxiv.org/list/cs.LG/recent,Unified token representations for sequential decision models,"Zhuojing Tian, Yushu Chen",https://arxiv.org/abs/2510.21448,https://arxiv.org/pdf/2510.21448
https://arxiv.org/list/cs.LG/recent,Causality Meets Locality: Provably Generalizable and Scalable Policy Learning for Networked Systems,"Hao Liang, Shuqing Shi, Yudi Zhang, Biwei Huang, Yali Du",https://arxiv.org/abs/2510.21427,https://arxiv.org/pdf/2510.21427
https://arxiv.org/list/cs.LG/recent,A Rapid Physics-Informed Machine Learning Framework Based on Extreme Learning Machine for Inverse Stefan Problems,"Pei-Zhi Zhuang, Ming-Yue Yang, Fei Ren, Hong-Ya Yue, He Yang",https://arxiv.org/abs/2510.21426,https://arxiv.org/pdf/2510.21426
https://arxiv.org/list/cs.LG/recent,DreamerV3-XP: Optimizing exploration through uncertainty estimation,"Lukas Bierling, Davide Pasero, Jan-Henrik Bertrand, Kiki Van Gerwen",https://arxiv.org/abs/2510.21418,https://arxiv.org/pdf/2510.21418
https://arxiv.org/list/cs.LG/recent,Self-diffusion for Solving Inverse Problems,"Guanxiong Luo, Shoujin Huang, Yanlong Yang",https://arxiv.org/abs/2510.21417,https://arxiv.org/pdf/2510.21417
https://arxiv.org/list/cs.LG/recent,Large Language Models as Model Organisms for Human Associative Learning,"Camila Kolling, Vy Ai Vo, Mariya Toneva",https://arxiv.org/abs/2510.21408,https://arxiv.org/pdf/2510.21408
https://arxiv.org/list/cs.LG/recent,Disentangled Representation Learning via Modular Compositional Bias,"Whie Jung, Dong Hoon Lee, Seunghoon Hong",https://arxiv.org/abs/2510.21402,https://arxiv.org/pdf/2510.21402
https://arxiv.org/list/cs.LG/recent,Assessing the Real-World Utility of Explainable AI for Arousal Diagnostics: An Application-Grounded User Study,"Stefan Kraft, Andreas Theissler, Vera Wienhausen-Wilke, Gjergji Kasneci, Hendrik Lensch",https://arxiv.org/abs/2510.21389,https://arxiv.org/pdf/2510.21389
https://arxiv.org/list/cs.LG/recent,Cost-Sensitive Freeze-thaw Bayesian Optimization for Efficient Hyperparameter Tuning,"Dong Bok Lee, Aoxuan Silvia Zhang, Byungjoo Kim, Junhyeon Park, Steven Adriaensen, Juho Lee, Sung Ju Hwang, Hae Beom Lee",https://arxiv.org/abs/2510.21379,https://arxiv.org/pdf/2510.21379
https://arxiv.org/list/cs.LG/recent,Randomized Neural Network with Adaptive Forward Regularization for Online Task-free Class Incremental Learning,"Junda Wang, Minghui Hu, Ning Li, Abdulaziz Al-Ali, Ponnuthurai Nagaratnam Suganthan",https://arxiv.org/abs/2510.21367,https://arxiv.org/pdf/2510.21367
https://arxiv.org/list/cs.LG/recent,FairImagen: Post-Processing for Bias Mitigation in Text-to-Image Models,"Zihao Fu, Ryan Brown, Shun Shao, Kai Rawal, Eoin Delaney, Chris Russell",https://arxiv.org/abs/2510.21363,https://arxiv.org/pdf/2510.21363
https://arxiv.org/list/cs.LG/recent,Compositional Monte Carlo Tree Diffusion for Extendable Planning,"Jaesik Yoon, Hyeonseo Cho, Sungjin Ahn",https://arxiv.org/abs/2510.21361,https://arxiv.org/pdf/2510.21361
https://arxiv.org/list/cs.LG/recent,Robust Yield Curve Estimation for Mortgage Bonds Using Neural Networks,"Sina Molavipour, Alireza M. Javid, Cassie Ye, Björn Löfdahl, Mikhail Nechaev",https://arxiv.org/abs/2510.21347,https://arxiv.org/pdf/2510.21347
https://arxiv.org/list/cs.LG/recent,$α$-LoRA: Effective Fine-Tuning via Base Model Rescaling,"Aymane El Firdoussi, El Mahdi Chayti, Mohamed El Amine Seddik, Martin Jaggi",https://arxiv.org/abs/2510.21345,https://arxiv.org/pdf/2510.21345
https://arxiv.org/list/cs.LG/recent,Weak-to-Strong Generalization under Distribution Shifts,"Myeongho Jeon, Jan Sobotka, Suhwan Choi, Maria Brbić",https://arxiv.org/abs/2510.21332,https://arxiv.org/pdf/2510.21332
https://arxiv.org/list/cs.LG/recent,SCORENF: Score-based Normalizing Flows for Sampling Unnormalized distributions,"Vikas Kanaujia, Vipul Arora",https://arxiv.org/abs/2510.21330,https://arxiv.org/pdf/2510.21330
https://arxiv.org/list/cs.LG/recent,Leverage Unlearning to Sanitize LLMs,"Antoine Boutet, Lucas Magnana",https://arxiv.org/abs/2510.21322,https://arxiv.org/pdf/2510.21322
https://arxiv.org/list/cs.LG/recent,A Convergence Analysis of Adaptive Optimizers under Floating-point Quantization,"Xuan Tang, Jichu Li, Difan Zou",https://arxiv.org/abs/2510.21314,https://arxiv.org/pdf/2510.21314
https://arxiv.org/list/cs.LG/recent,Revisiting Social Welfare in Bandits: UCB is (Nearly) All You Need,"Dhruv Sarkar, Nishant Pandey, Sayak Ray Chowdhury",https://arxiv.org/abs/2510.21312,https://arxiv.org/pdf/2510.21312
https://arxiv.org/list/cs.LG/recent,Data as a Lever: A Neighbouring Datasets Perspective on Predictive Multiplicity,"Prakhar Ganesh, Hsiang Hsu, Golnoosh Farnadi",https://arxiv.org/abs/2510.21303,https://arxiv.org/pdf/2510.21303
https://arxiv.org/list/cs.LG/recent,Amortized Variational Inference for Partial-Label Learning: A Probabilistic Approach to Label Disambiguation,"Tobias Fuchs, Nadja Klein",https://arxiv.org/abs/2510.21300,https://arxiv.org/pdf/2510.21300
https://arxiv.org/list/cs.LG/recent,An Evidence-Based Post-Hoc Adjustment Framework for Anomaly Detection Under Data Contamination,"Sukanya Patra, Souhaib Ben Taieb",https://arxiv.org/abs/2510.21296,https://arxiv.org/pdf/2510.21296
https://arxiv.org/list/cs.LG/recent,Additive Models Explained: A Computational Complexity Approach,"Shahaf Bassan, Michal Moshkovitz, Guy Katz",https://arxiv.org/abs/2510.21292,https://arxiv.org/pdf/2510.21292
https://arxiv.org/list/cs.LG/recent,Adaptive Data Selection for Multi-Layer Perceptron Training: A Sub-linear Value-Driven Method,"Xiyang Zhang, Chen Liang, Haoxuan Qiu, Hongzhi Wang",https://arxiv.org/abs/2510.21286,https://arxiv.org/pdf/2510.21286
