source_url,title,authors,journal_info,abstract_url
https://pubmed.ncbi.nlm.nih.gov/?term=deep%20learning&page=50,Towards sustainable architecture: Enhancing green building energy consumption prediction with integrated variational autoencoders and self-attentive gated recurrent units from multifaceted datasets.,"Zeng Q, Peng F, Han X.",PLoS One. 2025 Apr 25;20(4):e0317514. doi: 10.1371/journal.pone.0317514. eCollection 2025.,https://pubmed.ncbi.nlm.nih.gov/40279377/
https://pubmed.ncbi.nlm.nih.gov/?term=deep%20learning&page=50,A Perspective on Natural Language Understanding Capability: An Interview with Sam Bowman.,"Dhar V, Bowman S.",Big Data. 2017 Mar;5(1):5-11. doi: 10.1089/big.2017.29016.sbo.,https://pubmed.ncbi.nlm.nih.gov/28328254/
https://pubmed.ncbi.nlm.nih.gov/?term=deep%20learning&page=51,Multi-Sensor Fault Diagnosis of Underwater Thruster Propeller Based onDeepLearning.,"Tsai CM, Wang CS, Chung YJ, Sun YD, Perng JW.",Sensors (Basel). 2021 Oct 29;21(21):7187. doi: 10.3390/s21217187.,https://pubmed.ncbi.nlm.nih.gov/34770494/
https://pubmed.ncbi.nlm.nih.gov/?term=deep%20learning&page=51,[Research progress and challenges ofdeeplearningin medical image registration].,"Zou M, Yang H, Pan G, Zhong Y.",Sheng Wu Yi Xue Gong Cheng Xue Za Zhi. 2019 Aug 25;36(4):677-683. doi: 10.7507/1001-5515.201810004.,https://pubmed.ncbi.nlm.nih.gov/31441271/
https://pubmed.ncbi.nlm.nih.gov/?term=deep%20learning&page=51,[11.DeepLearningin Magnetic Resonance Imaging: An Overview and Applications].,Sagawa H.,Nihon Hoshasen Gijutsu Gakkai Zasshi. 2022;78(8):876-881. doi: 10.6009/jjrt.2022-2069.,https://pubmed.ncbi.nlm.nih.gov/35989257/
https://pubmed.ncbi.nlm.nih.gov/?term=deep%20learning&page=51,Carbon price forecasting: a noveldeeplearningapproach.,"Zhang F, Wen N.",Environ Sci Pollut Res Int. 2022 Aug;29(36):54782-54795. doi: 10.1007/s11356-022-19713-x. Epub 2022 Mar 19.,https://pubmed.ncbi.nlm.nih.gov/35306656/
https://pubmed.ncbi.nlm.nih.gov/?term=deep%20learning&page=51,DeepLearningand Infrared Spectroscopy: RepresentationLearningwith a beta-Variational Autoencoder.,"Grossutti M, D'Amico J, Quintal J, MacFarlane H, Quirk A, Dutcher JR.",J Phys Chem Lett. 2022 Jun 30;13(25):5787-5793. doi: 10.1021/acs.jpclett.2c01328. Epub 2022 Jun 21.,https://pubmed.ncbi.nlm.nih.gov/35726872/
https://pubmed.ncbi.nlm.nih.gov/?term=deep%20learning&page=51,Prediction Model of Piano Collective Class Teaching andLearningEffect Based onDeepLearning.,Zhu X.,Comput Intell Neurosci. 2022 Jul 18;2022:2572372. doi: 10.1155/2022/2572372. eCollection 2022.,https://pubmed.ncbi.nlm.nih.gov/35898779/
https://pubmed.ncbi.nlm.nih.gov/?term=deep%20learning&page=51,Cx22: A new publicly available dataset fordeeplearning-based segmentation of cervical cytology images.,"Liu G, Ding Q, Luo H, Sha M, Li X, Ju M.",Comput Biol Med. 2022 Nov;150:106194. doi: 10.1016/j.compbiomed.2022.106194. Epub 2022 Oct 14.,https://pubmed.ncbi.nlm.nih.gov/37859287/
https://pubmed.ncbi.nlm.nih.gov/?term=deep%20learning&page=51,Deeplearningin target prediction and drug repositioning: Recent advances and challenges.,"Yu JL, Dai QQ, Li GB.",Drug Discov Today. 2022 Jul;27(7):1796-1814. doi: 10.1016/j.drudis.2021.10.010. Epub 2021 Oct 27.,https://pubmed.ncbi.nlm.nih.gov/34718208/
https://pubmed.ncbi.nlm.nih.gov/?term=deep%20learning&page=51,Deciphering cis-regulatory grammar withdeeplearning.,"Miraldi ER, Chen X, Weirauch MT.",Nat Genet. 2021 Mar;53(3):266-268. doi: 10.1038/s41588-021-00814-1.,https://pubmed.ncbi.nlm.nih.gov/33686263/
https://pubmed.ncbi.nlm.nih.gov/?term=deep%20learning&page=51,Smart Memory Storage Solution and Elderly Oriented Smart Equipment Design underDeepLearning.,"Gong C, Liu R, Zhou N, Luo J, Kumar Jain D.",Comput Intell Neurosci. 2022 May 9;2022:6448302. doi: 10.1155/2022/6448302. eCollection 2022.,https://pubmed.ncbi.nlm.nih.gov/35586089/
https://pubmed.ncbi.nlm.nih.gov/?term=deep%20learning&page=52,Molecular Energies Derived fromDeepLearning: Application to the Prediction of Formation Enthalpies Up to High Energy Compounds.,Mathieu D.,Mol Inform. 2022 May;41(5):e2100064. doi: 10.1002/minf.202100064. Epub 2021 Dec 10.,https://pubmed.ncbi.nlm.nih.gov/34894091/
https://pubmed.ncbi.nlm.nih.gov/?term=deep%20learning&page=52,Deeplearningin target prediction and drug repositioning: Recent advances and challenges.,"Yu JL, Dai QQ, Li GB.",Drug Discov Today. 2022 Jul;27(7):1796-1814. doi: 10.1016/j.drudis.2021.10.010. Epub 2021 Oct 27.,https://pubmed.ncbi.nlm.nih.gov/34718208/
https://pubmed.ncbi.nlm.nih.gov/?term=deep%20learning&page=52,Deciphering cis-regulatory grammar withdeeplearning.,"Miraldi ER, Chen X, Weirauch MT.",Nat Genet. 2021 Mar;53(3):266-268. doi: 10.1038/s41588-021-00814-1.,https://pubmed.ncbi.nlm.nih.gov/33686263/
https://pubmed.ncbi.nlm.nih.gov/?term=deep%20learning&page=52,Smart Memory Storage Solution and Elderly Oriented Smart Equipment Design underDeepLearning.,"Gong C, Liu R, Zhou N, Luo J, Kumar Jain D.",Comput Intell Neurosci. 2022 May 9;2022:6448302. doi: 10.1155/2022/6448302. eCollection 2022.,https://pubmed.ncbi.nlm.nih.gov/35586089/
https://pubmed.ncbi.nlm.nih.gov/?term=deep%20learning&page=52,Training UniversalDeep-LearningNetworks for Electromagnetic Medical Imaging Using a Large Database of Randomized Objects.,"Xue F, Guo L, Bialkowski A, Abbosh A.",Sensors (Basel). 2023 Dec 19;24(1):8. doi: 10.3390/s24010008.,https://pubmed.ncbi.nlm.nih.gov/38202870/
https://pubmed.ncbi.nlm.nih.gov/?term=deep%20learning&page=52,WhyDeepLearningIs Changing the Way to Approach NGS Data Processing: A Review.,"Celesti F, Celesti A, Wan J, Villari M.",IEEE Rev Biomed Eng. 2018;11:68-76. doi: 10.1109/RBME.2018.2825987. Epub 2018 Apr 12.,https://pubmed.ncbi.nlm.nih.gov/29993643/
https://pubmed.ncbi.nlm.nih.gov/?term=deep%20learning&page=52,"DeepWL: Robust EPID based Winston-Lutz analysis usingdeeplearning, synthetic image generation and optical path-tracing.","Douglass MJJ, Keal JA.",Phys Med. 2021 Sep;89:306-316. doi: 10.1016/j.ejmp.2021.08.012. Epub 2021 Sep 4.,https://pubmed.ncbi.nlm.nih.gov/34492498/
https://pubmed.ncbi.nlm.nih.gov/?term=deep%20learning&page=52,Application ofdeeplearningfor the analysis of stomata: a review of current methods and future directions.,"Gibbs JA, Burgess AJ.",J Exp Bot. 2024 Nov 15;75(21):6704-6718. doi: 10.1093/jxb/erae207.,https://pubmed.ncbi.nlm.nih.gov/38716775/
https://pubmed.ncbi.nlm.nih.gov/?term=deep%20learning&page=52,MetaAc4C: A multi-moduledeeplearningframework for accurate prediction of N4-acetylcytidine sites based on pre-trained bidirectional encoder representation and generative adversarial networks.,"Li Z, Jin B, Fang J.",Genomics. 2024 Jan;116(1):110749. doi: 10.1016/j.ygeno.2023.110749. Epub 2023 Nov 25.,https://pubmed.ncbi.nlm.nih.gov/38008265/
https://pubmed.ncbi.nlm.nih.gov/?term=deep%20learning&page=52,Automated quantification of lipid contents of Lipomyces starkeyi usingdeep-learning-based image segmentation.,"Oh JJ, Jin Ko Y, Jun Kim Y, Kwon H, Lee C.",Bioresour Technol. 2024 Feb;393:130015. doi: 10.1016/j.biortech.2023.130015. Epub 2023 Nov 16.,https://pubmed.ncbi.nlm.nih.gov/37979884/
https://pubmed.ncbi.nlm.nih.gov/?term=deep%20learning&page=53,Behavioral tracking gets real.,"Wei K, Kording KP.",Nat Neurosci. 2018 Sep;21(9):1146-1147. doi: 10.1038/s41593-018-0215-0.,https://pubmed.ncbi.nlm.nih.gov/30127429/
https://pubmed.ncbi.nlm.nih.gov/?term=deep%20learning&page=53,Benchmarking Object DetectionDeepLearningModels in Embedded Devices.,"Cantero D, Esnaola-Gonzalez I, Miguel-Alonso J, Jauregi E.",Sensors (Basel). 2022 May 31;22(11):4205. doi: 10.3390/s22114205.,https://pubmed.ncbi.nlm.nih.gov/35684827/
https://pubmed.ncbi.nlm.nih.gov/?term=deep%20learning&page=53,A review of medical image data augmentation techniques fordeeplearningapplications.,"Chlap P, Min H, Vandenberg N, Dowling J, Holloway L, Haworth A.",J Med Imaging Radiat Oncol. 2021 Aug;65(5):545-563. doi: 10.1111/1754-9485.13261. Epub 2021 Jun 19.,https://pubmed.ncbi.nlm.nih.gov/34145766/
https://pubmed.ncbi.nlm.nih.gov/?term=deep%20learning&page=53,Predicting DNA Reactions with a Quantum Chemistry-BasedDeepLearningModel.,"Wang L, Li N, Cao M, Zhu Y, Xiong X, Li L, Zhu T, Pei H.",Adv Sci (Weinh). 2024 Nov;11(42):e2409880. doi: 10.1002/advs.202409880. Epub 2024 Sep 19.,https://pubmed.ncbi.nlm.nih.gov/39297371/
https://pubmed.ncbi.nlm.nih.gov/?term=deep%20learning&page=53,Online music-assisted rehabilitation system for depressed people based ondeeplearning.,"Heping Y, Bin W.",Prog Neuropsychopharmacol Biol Psychiatry. 2022 Dec 20;119:110607. doi: 10.1016/j.pnpbp.2022.110607. Epub 2022 Jul 18.,https://pubmed.ncbi.nlm.nih.gov/35863472/
https://pubmed.ncbi.nlm.nih.gov/?term=deep%20learning&page=53,Intelligent DiscreteDeepLearningBased Classification Methodology in Chemometrics.,"Khashei M, Nazgouei E, Bakhtiarvand N.",J Chem Inf Model. 2023 Apr 10;63(7):1935-1946. doi: 10.1021/acs.jcim.2c01535. Epub 2023 Feb 10.,https://pubmed.ncbi.nlm.nih.gov/36763004/
https://pubmed.ncbi.nlm.nih.gov/?term=deep%20learning&page=53,Antenna Impedance Matching UsingDeepLearning.,"Kim JH, Bang J.",Sensors (Basel). 2021 Oct 12;21(20):6766. doi: 10.3390/s21206766.,https://pubmed.ncbi.nlm.nih.gov/34695978/
https://pubmed.ncbi.nlm.nih.gov/?term=deep%20learning&page=53,Applications ofdeeplearningin fundus images: A review.,"Li T, Bo W, Hu C, Kang H, Liu H, Wang K, Fu H.",Med Image Anal. 2021 Apr;69:101971. doi: 10.1016/j.media.2021.101971. Epub 2021 Jan 20.,https://pubmed.ncbi.nlm.nih.gov/33524824/
https://pubmed.ncbi.nlm.nih.gov/?term=deep%20learning&page=53,Adverse Drug Event Detection from Electronic Health Records Using Hierarchical Recurrent Neural Networks with Dual-Level Embedding.,"Wunnava S, Qin X, Kakar T, Sen C, Rundensteiner EA, Kong X.",Drug Saf. 2019 Jan;42(1):113-122. doi: 10.1007/s40264-018-0765-9.,https://pubmed.ncbi.nlm.nih.gov/30649736/
https://pubmed.ncbi.nlm.nih.gov/?term=deep%20learning&page=53,A knowledge-integrateddeeplearningframework for cellular image analysis in parasite microbiology.,"Feng R, Li S, Zhang Y.",STAR Protoc. 2023 Sep 15;4(3):102452. doi: 10.1016/j.xpro.2023.102452. Epub 2023 Aug 1.,https://pubmed.ncbi.nlm.nih.gov/37537845/
https://pubmed.ncbi.nlm.nih.gov/?term=deep%20learning&page=54,DeepLearningfor Intelligent Assessment of Financial Investment Risk Prediction.,"Sun Y, Li J.",Comput Intell Neurosci. 2022 Oct 11;2022:3062566. doi: 10.1155/2022/3062566. eCollection 2022.,https://pubmed.ncbi.nlm.nih.gov/36268154/
https://pubmed.ncbi.nlm.nih.gov/?term=deep%20learning&page=54,Deep-Learning-Based Approach for Iraqi and Malaysian Vehicle License Plate Recognition.,"Habeeb D, Noman F, Alkahtani AA, Alsariera YA, Alkawsi G, Fazea Y, Al-Jubari AM.",Comput Intell Neurosci. 2021 Nov 6;2021:3971834. doi: 10.1155/2021/3971834. eCollection 2021.,https://pubmed.ncbi.nlm.nih.gov/34782832/
https://pubmed.ncbi.nlm.nih.gov/?term=deep%20learning&page=54,Usingdeeplearningto identify recent positive selection in malaria parasite sequence data.,"Deelder W, Benavente ED, Phelan J, Manko E, Campino S, Palla L, Clark TG.",Malar J. 2021 Jun 14;20(1):270. doi: 10.1186/s12936-021-03788-x.,https://pubmed.ncbi.nlm.nih.gov/34126997/
https://pubmed.ncbi.nlm.nih.gov/?term=deep%20learning&page=54,"A Molecular Image-Based Novel Quantitative Structure-Activity Relationship Approach, Deepsnap-DeepLearningand MachineLearning.","Matsuzaka Y, Uesawa Y.",Curr Issues Mol Biol. 2021;42:455-472. doi: 10.21775/cimb.042.455. Epub 2020 Dec 19.,https://pubmed.ncbi.nlm.nih.gov/33339777/
https://pubmed.ncbi.nlm.nih.gov/?term=deep%20learning&page=54,Database Oriented Big Data Analysis Engine Based onDeepLearning.,Shang X.,Comput Intell Neurosci. 2022 Aug 31;2022:4500684. doi: 10.1155/2022/4500684. eCollection 2022.,https://pubmed.ncbi.nlm.nih.gov/36093505/
https://pubmed.ncbi.nlm.nih.gov/?term=deep%20learning&page=54,A Rumor Detection Method from Social Network Based onDeepLearningin Big Data Environment.,"Cen J, Li Y.",Comput Intell Neurosci. 2022 Mar 28;2022:1354233. doi: 10.1155/2022/1354233. eCollection 2022.,https://pubmed.ncbi.nlm.nih.gov/35387254/
https://pubmed.ncbi.nlm.nih.gov/?term=deep%20learning&page=54,Cross-Border E-Commerce Intelligent Information Recommendation System Based onDeepLearning.,Li L.,Comput Intell Neurosci. 2022 Feb 23;2022:6602471. doi: 10.1155/2022/6602471. eCollection 2022.,https://pubmed.ncbi.nlm.nih.gov/35251154/
https://pubmed.ncbi.nlm.nih.gov/?term=deep%20learning&page=54,Developing and EvaluatingDeepLearningAlgorithms for Object Detection: Key Points for Achieving Superior Model Performance.,"Oh JH, Kim HG, Lee KM.",Korean J Radiol. 2023 Jul;24(7):698-714. doi: 10.3348/kjr.2022.0765.,https://pubmed.ncbi.nlm.nih.gov/37404112/
https://pubmed.ncbi.nlm.nih.gov/?term=deep%20learning&page=54,Year 2023 in Biomedical Natural Language Processing: a Tribute to Large Language Models and Generative AI.,"Grouin C, Grabar N.",Yearb Med Inform. 2024 Aug;33(1):241-248. doi: 10.1055/s-0044-1800751. Epub 2025 Apr 8.,https://pubmed.ncbi.nlm.nih.gov/40199311/
https://pubmed.ncbi.nlm.nih.gov/?term=deep%20learning&page=54,Deeplearningfor advancing peptide drug development: Tools and methods in structure prediction and design.,"Wu X, Lin H, Bai R, Duan H.",Eur J Med Chem. 2024 Mar 15;268:116262. doi: 10.1016/j.ejmech.2024.116262. Epub 2024 Feb 19.,https://pubmed.ncbi.nlm.nih.gov/38387334/
https://pubmed.ncbi.nlm.nih.gov/?term=deep%20learning&page=55,Higher Education Curriculum Evaluation Method Based onDeepLearningModel.,"Zuo M, Wang J.",Comput Intell Neurosci. 2021 Nov 24;2021:9036550. doi: 10.1155/2021/9036550. eCollection 2021.,https://pubmed.ncbi.nlm.nih.gov/34868300/
https://pubmed.ncbi.nlm.nih.gov/?term=deep%20learning&page=55,Supervised and Weakly SupervisedDeepLearningfor Segmentation and Counting of Cotton Bolls Using Proximal Imagery.,"Adke S, Li C, Rasheed KM, Maier FW.",Sensors (Basel). 2022 May 12;22(10):3688. doi: 10.3390/s22103688.,https://pubmed.ncbi.nlm.nih.gov/35632096/
https://pubmed.ncbi.nlm.nih.gov/?term=deep%20learning&page=55,Cancer diagnosis using generative adversarial networks based ondeeplearningfrom imbalanced data.,"Xiao Y, Wu J, Lin Z.",Comput Biol Med. 2021 Aug;135:104540. doi: 10.1016/j.compbiomed.2021.104540. Epub 2021 Jun 12.,https://pubmed.ncbi.nlm.nih.gov/34153791/
https://pubmed.ncbi.nlm.nih.gov/?term=deep%20learning&page=55,LeveragingDeepLearningto Improve Safety of Outpatient Hemodialysis.,"Correa S, Mc Causland FR.",Clin J Am Soc Nephrol. 2021 Mar 8;16(3):343-344. doi: 10.2215/CJN.00450121. Epub 2021 Feb 11.,https://pubmed.ncbi.nlm.nih.gov/33574057/
https://pubmed.ncbi.nlm.nih.gov/?term=deep%20learning&page=55,DeepLearning-Based Classification of Macrofungi: Comparative Analysis of Advanced Models for Accurate Fungi Identification.,"Ozsari S, Kumru E, Ekinci F, Akata I, Guzel MS, Acici K, Ozcan E, Asuroglu T.",Sensors (Basel). 2024 Nov 9;24(22):7189. doi: 10.3390/s24227189.,https://pubmed.ncbi.nlm.nih.gov/39598966/
https://pubmed.ncbi.nlm.nih.gov/?term=deep%20learning&page=55,Unpaired MR Motion ArtifactDeepLearningUsing Outlier-Rejecting Bootstrap Aggregation.,"Oh G, Lee JE, Ye JC.",IEEE Trans Med Imaging. 2021 Nov;40(11):3125-3139. doi: 10.1109/TMI.2021.3089708. Epub 2021 Oct 27.,https://pubmed.ncbi.nlm.nih.gov/34133276/
https://pubmed.ncbi.nlm.nih.gov/?term=deep%20learning&page=55,Deeplearning-based anomaly detection from ultrasonic images.,"Posilović L, Medak D, Milković F, Subašić M, Budimir M, Lončarić S.",Ultrasonics. 2022 Aug;124:106737. doi: 10.1016/j.ultras.2022.106737. Epub 2022 Apr 2.,https://pubmed.ncbi.nlm.nih.gov/35427859/
https://pubmed.ncbi.nlm.nih.gov/?term=deep%20learning&page=55,"Sea Mine Detection Framework Using YOLO, SSD and EfficientDetDeepLearningModels.","Munteanu D, Moina D, Zamfir CG, Petrea ȘM, Cristea DS, Munteanu N.",Sensors (Basel). 2022 Dec 6;22(23):9536. doi: 10.3390/s22239536.,https://pubmed.ncbi.nlm.nih.gov/36502238/
https://pubmed.ncbi.nlm.nih.gov/?term=deep%20learning&page=55,A systematic assessment ofdeeplearningmethods for drug response prediction: from in vitro to clinical applications.,"Shen B, Feng F, Li K, Lin P, Ma L, Li H.",Brief Bioinform. 2023 Jan 19;24(1):bbac605. doi: 10.1093/bib/bbac605.,https://pubmed.ncbi.nlm.nih.gov/36575826/
https://pubmed.ncbi.nlm.nih.gov/?term=deep%20learning&page=55,A review on real time implementation of soft computing techniques in thermal power plant.,"Thawait LK, Singh MK.",Network. 2025 Feb;36(1):1-37. doi: 10.1080/0954898X.2024.2429721. Epub 2024 Nov 27.,https://pubmed.ncbi.nlm.nih.gov/39601783/
https://pubmed.ncbi.nlm.nih.gov/?term=deep%20learning&page=56,Classification of Diagnostic Certainty in Radiology Reports withDeepLearning.,"Sugimoto K, Wada S, Konishi S, Okada K, Manabe S, Matsumura Y, Takeda T.",Stud Health Technol Inform. 2024 Jan 25;310:569-573. doi: 10.3233/SHTI231029.,https://pubmed.ncbi.nlm.nih.gov/38269873/
https://pubmed.ncbi.nlm.nih.gov/?term=deep%20learning&page=56,scTour: adeeplearningarchitecture for robust inference and accurate prediction of cellular dynamics.,Li Q.,Genome Biol. 2023 Jun 23;24(1):149. doi: 10.1186/s13059-023-02988-9.,https://pubmed.ncbi.nlm.nih.gov/37353848/
https://pubmed.ncbi.nlm.nih.gov/?term=deep%20learning&page=56,Marrying Medical Domain Knowledge WithDeepLearningon Electronic Health Records: ADeepVisual Analytics Approach.,"Li R, Yin C, Yang S, Qian B, Zhang P.",J Med Internet Res. 2020 Sep 28;22(9):e20645. doi: 10.2196/20645.,https://pubmed.ncbi.nlm.nih.gov/32985996/
https://pubmed.ncbi.nlm.nih.gov/?term=deep%20learning&page=56,Scaling biological discovery at the interface ofdeeplearningand cellular imaging.,"Schwartz M, Israel U, Wang XJ, Laubscher E, Yu C, Dilip R, Li Q, Mari J, Soro J, Yu K, Pradhan E, Ates A, Gallandt D, Barnowski R, Pao E, Van Valen D.",Nat Methods. 2023 Jul;20(7):956-957. doi: 10.1038/s41592-023-01931-x.,https://pubmed.ncbi.nlm.nih.gov/37434003/
https://pubmed.ncbi.nlm.nih.gov/?term=deep%20learning&page=56,Deeplearningfor centre manifold reduction and stability analysis in nonlinear systems.,"Ghadami A, Epureanu BI.",Philos Trans A Math Phys Eng Sci. 2022 Aug 8;380(2229):20210212. doi: 10.1098/rsta.2021.0212. Epub 2022 Jun 20.,https://pubmed.ncbi.nlm.nih.gov/35719074/
https://pubmed.ncbi.nlm.nih.gov/?term=deep%20learning&page=56,Reducing Detrimental Communication Failure Impacts in Microgrids by UsingDeepLearningTechniques.,"Arbab-Zavar B, Sharkh SM, Palacios-Garcia EJ, Vasquez JC, Guerrero JM.",Sensors (Basel). 2022 Aug 11;22(16):6006. doi: 10.3390/s22166006.,https://pubmed.ncbi.nlm.nih.gov/36015769/
https://pubmed.ncbi.nlm.nih.gov/?term=deep%20learning&page=56,A Guide for UsingDeepLearningfor Complex Trait Genomic Prediction.,"Pérez-Enciso M, Zingaretti LM.",Genes (Basel). 2019 Jul 20;10(7):553. doi: 10.3390/genes10070553.,https://pubmed.ncbi.nlm.nih.gov/31330861/
https://pubmed.ncbi.nlm.nih.gov/?term=deep%20learning&page=56,An overview ofdeeplearningapplications in precocious puberty and thyroid dysfunction.,"Razzaq M, Clément F, Yvinec R.",Front Endocrinol (Lausanne). 2022 Oct 20;13:959546. doi: 10.3389/fendo.2022.959546. eCollection 2022.,https://pubmed.ncbi.nlm.nih.gov/36339395/
https://pubmed.ncbi.nlm.nih.gov/?term=deep%20learning&page=56,PD-BertEDL: An EnsembleDeepLearningMethod Using BERT and Multivariate Representation to Predict Peptide Detectability.,"Wang H, Wang J, Feng Z, Li Y, Zhao H.",Int J Mol Sci. 2022 Oct 16;23(20):12385. doi: 10.3390/ijms232012385.,https://pubmed.ncbi.nlm.nih.gov/36293242/
https://pubmed.ncbi.nlm.nih.gov/?term=deep%20learning&page=56,Towards InterpretableDeepLearning: A Feature Selection Framework for Prognostics and Health Management UsingDeepNeural Networks.,"Figueroa Barraza J, López Droguett E, Martins MR.",Sensors (Basel). 2021 Sep 1;21(17):5888. doi: 10.3390/s21175888.,https://pubmed.ncbi.nlm.nih.gov/34502778/
https://pubmed.ncbi.nlm.nih.gov/?term=deep%20learning&page=57,Improved Face Detection Method viaLearningSmall Faces on Hard Images Based on aDeepLearningApproach.,"Mamieva D, Abdusalomov AB, Mukhiddinov M, Whangbo TK.",Sensors (Basel). 2023 Jan 2;23(1):502. doi: 10.3390/s23010502.,https://pubmed.ncbi.nlm.nih.gov/36617097/
https://pubmed.ncbi.nlm.nih.gov/?term=deep%20learning&page=57,A Robust Context-BasedDeepLearningApproach for Highly Imbalanced Hyperspectral Classification.,"Ramirez Rochac JF, Zhang N, Thompson LA, Deksissa T.",Comput Intell Neurosci. 2021 Jul 6;2021:9923491. doi: 10.1155/2021/9923491. eCollection 2021.,https://pubmed.ncbi.nlm.nih.gov/34306058/
https://pubmed.ncbi.nlm.nih.gov/?term=deep%20learning&page=57,Class-Variant Margin Normalized Softmax Loss forDeepFace Recognition.,"Zhang W, Chen Y, Yang W, Wang G, Xue JH, Liao Q.",IEEE Trans Neural Netw Learn Syst. 2021 Oct;32(10):4742-4747. doi: 10.1109/TNNLS.2020.3017528. Epub 2021 Oct 5.,https://pubmed.ncbi.nlm.nih.gov/32857706/
https://pubmed.ncbi.nlm.nih.gov/?term=deep%20learning&page=57,Rethinking Saliency Map: A Context-Aware Perturbation Method to Explain EEG-BasedDeepLearningModel.,"Wang H, Zhu X, Chen T, Li C, Song L.",IEEE Trans Biomed Eng. 2023 May;70(5):1462-1472. doi: 10.1109/TBME.2022.3218116. Epub 2023 Apr 20.,https://pubmed.ncbi.nlm.nih.gov/36315542/
https://pubmed.ncbi.nlm.nih.gov/?term=deep%20learning&page=57,DeepLearningApproach Based on Transcriptome Profile for Data Driven Drug Discovery.,"Kwon EJ, Cha HJ.",Mol Cells. 2023 Jan 31;46(1):65-67. doi: 10.14348/molcells.2023.2167. Epub 2023 Jan 20.,https://pubmed.ncbi.nlm.nih.gov/36697239/
https://pubmed.ncbi.nlm.nih.gov/?term=deep%20learning&page=57,DeepLearningAlgorithm for Online College Physical Education Teaching with Flipping Classroom.,Chen Z.,Comput Intell Neurosci. 2022 Aug 24;2022:8742661. doi: 10.1155/2022/8742661. eCollection 2022.,https://pubmed.ncbi.nlm.nih.gov/36059421/
https://pubmed.ncbi.nlm.nih.gov/?term=deep%20learning&page=57,Vehicle Image Detection Method UsingDeepLearningin UAV Video.,Wang X.,Comput Intell Neurosci. 2022 Feb 8;2022:8202535. doi: 10.1155/2022/8202535. eCollection 2022.,https://pubmed.ncbi.nlm.nih.gov/35178081/
https://pubmed.ncbi.nlm.nih.gov/?term=deep%20learning&page=57,DeepBelief Networks for Electroencephalography: A Review of Recent Contributions and Future Outlooks.,"Movahedi F, Coyle JL, Sejdic E.",IEEE J Biomed Health Inform. 2018 May;22(3):642-652. doi: 10.1109/JBHI.2017.2727218. Epub 2017 Jul 14.,https://pubmed.ncbi.nlm.nih.gov/28715343/
https://pubmed.ncbi.nlm.nih.gov/?term=deep%20learning&page=57,Thinking beyond the ventral stream: Comment on Bowers et al.,"Summerfield C, Thompson JAF.",Behav Brain Sci. 2023 Dec 6;46:e409. doi: 10.1017/S0140525X23001723.,https://pubmed.ncbi.nlm.nih.gov/38054346/
https://pubmed.ncbi.nlm.nih.gov/?term=deep%20learning&page=57,DeepLearningApplied to Vegetation Identification and Removal Using Multidimensional Aerial Data.,"F Pinto M, G Melo A, M Honório L, L M Marcato A, G S Conceição A, O Timotheo A.",Sensors (Basel). 2020 Oct 30;20(21):6187. doi: 10.3390/s20216187.,https://pubmed.ncbi.nlm.nih.gov/33143075/
https://pubmed.ncbi.nlm.nih.gov/?term=deep%20learning&page=58,Harnessingdeeplearningfor population genetic inference.,"Huang X, Rymbekova A, Dolgova O, Lao O, Kuhlwilm M.",Nat Rev Genet. 2024 Jan;25(1):61-78. doi: 10.1038/s41576-023-00636-3. Epub 2023 Sep 4.,https://pubmed.ncbi.nlm.nih.gov/37666948/
https://pubmed.ncbi.nlm.nih.gov/?term=deep%20learning&page=58,Thinking beyond the ventral stream: Comment on Bowers et al.,"Summerfield C, Thompson JAF.",Behav Brain Sci. 2023 Dec 6;46:e409. doi: 10.1017/S0140525X23001723.,https://pubmed.ncbi.nlm.nih.gov/38054346/
https://pubmed.ncbi.nlm.nih.gov/?term=deep%20learning&page=58,Deeplearningfor digitizing highly noisy paper-based ECG records.,"Li Y, Qu Q, Wang M, Yu L, Wang J, Shen L, He K.",Comput Biol Med. 2020 Dec;127:104077. doi: 10.1016/j.compbiomed.2020.104077. Epub 2020 Oct 28.,https://pubmed.ncbi.nlm.nih.gov/33171291/
https://pubmed.ncbi.nlm.nih.gov/?term=deep%20learning&page=58,"Deeplearningin bioinformatics: Introduction, application, and perspective in the big data era.","Li Y, Huang C, Ding L, Li Z, Pan Y, Gao X.",Methods. 2019 Aug 15;166:4-21. doi: 10.1016/j.ymeth.2019.04.008. Epub 2019 Apr 22.,https://pubmed.ncbi.nlm.nih.gov/31022451/
https://pubmed.ncbi.nlm.nih.gov/?term=deep%20learning&page=58,Deeplearning: A primer for dentists and dental researchers.,"Mohammad-Rahimi H, Rokhshad R, Bencharit S, Krois J, Schwendicke F.",J Dent. 2023 Mar;130:104430. doi: 10.1016/j.jdent.2023.104430. Epub 2023 Jan 20.,https://pubmed.ncbi.nlm.nih.gov/36682721/
https://pubmed.ncbi.nlm.nih.gov/?term=deep%20learning&page=58,Reply to: One neuron versusdeeplearningin aftershock prediction.,Meade BJ.,Nature. 2019 Oct;574(7776):E4. doi: 10.1038/s41586-019-1583-7.,https://pubmed.ncbi.nlm.nih.gov/31578474/
https://pubmed.ncbi.nlm.nih.gov/?term=deep%20learning&page=58,"In the Era ofDeepLearning, Why Reconstruct an Image at All?","Chung C, Kalpathy-Cramer J, Knopp MV, Jaffray DA.",J Am Coll Radiol. 2021 Jan;18(1 Pt B):170-173. doi: 10.1016/j.jacr.2020.09.050.,https://pubmed.ncbi.nlm.nih.gov/33413895/
https://pubmed.ncbi.nlm.nih.gov/?term=deep%20learning&page=58,Deeplearning-based waste detection in natural and urban environments.,"Majchrowska S, Mikołajczyk A, Ferlin M, Klawikowska Z, Plantykow MA, Kwasigroch A, Majek K.",Waste Manag. 2022 Feb 1;138:274-284. doi: 10.1016/j.wasman.2021.12.001. Epub 2021 Dec 14.,https://pubmed.ncbi.nlm.nih.gov/34920243/
https://pubmed.ncbi.nlm.nih.gov/?term=deep%20learning&page=58,Can Focusing on OneDeepLearningArchitecture Improve Fault Diagnosis Performance?,"Neto JG, Figueiredo K, Soares JBP, Brandão ALT.",J Chem Inf Model. 2025 Feb 10;65(3):1289-1304. doi: 10.1021/acs.jcim.4c02060. Epub 2025 Jan 30.,https://pubmed.ncbi.nlm.nih.gov/39883649/
