source_url,title,authors,journal_info,abstract_url
https://pubmed.ncbi.nlm.nih.gov/?term=deep%20learning&page=147,Unveiling the perceptions of Syrian and Turkish citizens afflicted by survivor guilt in the aftermath of the 2023 earthquake: A study based ondeeplearning.,"Praveen SV, Deepika R.",Asian J Psychiatr. 2023 Aug;86:103672. doi: 10.1016/j.ajp.2023.103672. Epub 2023 Jun 7.,https://pubmed.ncbi.nlm.nih.gov/37331116/
https://pubmed.ncbi.nlm.nih.gov/?term=deep%20learning&page=147,"BioPhi: A platform for antibody design, humanization, and humanness evaluation based on natural antibody repertoires anddeeplearning.","Prihoda D, Maamary J, Waight A, Juan V, Fayadat-Dilman L, Svozil D, Bitton DA.",MAbs. 2022 Jan-Dec;14(1):2020203. doi: 10.1080/19420862.2021.2020203.,https://pubmed.ncbi.nlm.nih.gov/35133949/
https://pubmed.ncbi.nlm.nih.gov/?term=deep%20learning&page=147,Intelligent Semantic Segmentation for Self-Driving Vehicles UsingDeepLearning.,"Sellat Q, Bisoy S, Priyadarshini R, Vidyarthi A, Kautish S, Barik RK.",Comput Intell Neurosci. 2022 Jan 17;2022:6390260. doi: 10.1155/2022/6390260. eCollection 2022.,https://pubmed.ncbi.nlm.nih.gov/35082843/
https://pubmed.ncbi.nlm.nih.gov/?term=deep%20learning&page=147,Deeplearningfor computational cytology: A survey.,"Jiang H, Zhou Y, Lin Y, Chan RCK, Liu J, Chen H.",Med Image Anal. 2023 Feb;84:102691. doi: 10.1016/j.media.2022.102691. Epub 2022 Nov 14.,https://pubmed.ncbi.nlm.nih.gov/36455333/
https://pubmed.ncbi.nlm.nih.gov/?term=deep%20learning&page=147,Enhancement of Patient Facial Recognition throughDeepLearningAlgorithm: ConvNet.,"Onyema EM, Shukla PK, Dalal S, Mathur MN, Zakariah M, Tiwari B.",J Healthc Eng. 2021 Dec 6;2021:5196000. doi: 10.1155/2021/5196000. eCollection 2021.,https://pubmed.ncbi.nlm.nih.gov/34912534/
https://pubmed.ncbi.nlm.nih.gov/?term=deep%20learning&page=147,[Application ofdeeplearningassisted electronic laryngoscope in diagnosis of laryngeal leukoplakia].,"Fu J, Li L, Yan Y, Ma F.",Lin Chuang Er Bi Yan Hou Tou Jing Wai Ke Za Zhi. 2021 May;35(5):464-467. doi: 10.13201/j.issn.2096-7993.2021.05.019.,https://pubmed.ncbi.nlm.nih.gov/34304477/
https://pubmed.ncbi.nlm.nih.gov/?term=deep%20learning&page=147,Improving Transfer Performance ofDeepLearningwith Adaptive Batch Normalization for Brain-computer Interfaces().,"Xu L, Ma Z, Meng J, Xu M, Jung TP, Ming D.",Annu Int Conf IEEE Eng Med Biol Soc. 2021 Nov;2021:5800-5803. doi: 10.1109/EMBC46164.2021.9629529.,https://pubmed.ncbi.nlm.nih.gov/34892438/
https://pubmed.ncbi.nlm.nih.gov/?term=deep%20learning&page=148,Deeplearningpowers cancer diagnosis in digital pathology.,"He Y, Zhao H, Wong STC.",Comput Med Imaging Graph. 2021 Mar;88:101820. doi: 10.1016/j.compmedimag.2020.101820. Epub 2020 Dec 11.,https://pubmed.ncbi.nlm.nih.gov/33453648/
https://pubmed.ncbi.nlm.nih.gov/?term=deep%20learning&page=148,DeepLearningfor Accurate Diagnosis of Glaucomatous Optic Neuropathy Using Digital Fundus Image: A Meta-Analysis.,"Islam M, Poly TN, Yang HC, Atique S, Li YJ.",Stud Health Technol Inform. 2020 Jun 16;270:153-157. doi: 10.3233/SHTI200141.,https://pubmed.ncbi.nlm.nih.gov/32570365/
https://pubmed.ncbi.nlm.nih.gov/?term=deep%20learning&page=148,Artificial Intelligence in Diabetic Retinopathy: Insights from a Meta-Analysis ofDeepLearning.,"Poly TN, Islam MM, Yang HC, Nguyen PA, Wu CC, Li YJ.",Stud Health Technol Inform. 2019 Aug 21;264:1556-1557. doi: 10.3233/SHTI190532.,https://pubmed.ncbi.nlm.nih.gov/31438229/
https://pubmed.ncbi.nlm.nih.gov/?term=deep%20learning&page=148,Generalization challenges in electrocardiogramdeeplearning: insights from dataset characteristics and attention mechanism.,"Huang Z, MacLachlan S, Yu L, Herbozo Contreras LF, Truong ND, Ribeiro AH, Kavehei O.",Future Cardiol. 2024 Mar 11;20(4):209-220. doi: 10.1080/14796678.2024.2354082. Epub 2024 Jun 5.,https://pubmed.ncbi.nlm.nih.gov/39049767/
https://pubmed.ncbi.nlm.nih.gov/?term=deep%20learning&page=148,Application of ReinforcementLearningandDeepLearningin Multiple-Input and Multiple-Output (MIMO) Systems.,"Naeem M, De Pietro G, Coronato A.",Sensors (Basel). 2021 Dec 31;22(1):309. doi: 10.3390/s22010309.,https://pubmed.ncbi.nlm.nih.gov/35009848/
https://pubmed.ncbi.nlm.nih.gov/?term=deep%20learning&page=148,Deeplearningfor automated detection and numbering of permanent teeth on panoramic images.,"Gurses BO, Sener E, Guneri P.",Dentomaxillofac Radiol. 2022 Jul 1;51(5):20220128. doi: 10.1259/dmfr.20220128. Epub 2022 May 4.,https://pubmed.ncbi.nlm.nih.gov/35507741/
https://pubmed.ncbi.nlm.nih.gov/?term=deep%20learning&page=148,DeepLearningin Medical Image Analysis.,"Chan HP, Samala RK, Hadjiiski LM, Zhou C.",Adv Exp Med Biol. 2020;1213:3-21. doi: 10.1007/978-3-030-33128-3_1.,https://pubmed.ncbi.nlm.nih.gov/32030660/
https://pubmed.ncbi.nlm.nih.gov/?term=deep%20learning&page=148,"Motivations for Artificial Intelligence, forDeepLearning, for ALife: Mortality and Existential Risk.",Harvey I.,Artif Life. 2024 Feb 1;30(1):48-64. doi: 10.1162/artl_a_00427.,https://pubmed.ncbi.nlm.nih.gov/38346273/
https://pubmed.ncbi.nlm.nih.gov/?term=deep%20learning&page=148,Advancing Biosensors with MachineLearning.,"Cui F, Yue Y, Zhang Y, Zhang Z, Zhou HS.",ACS Sens. 2020 Nov 25;5(11):3346-3364. doi: 10.1021/acssensors.0c01424. Epub 2020 Nov 13.,https://pubmed.ncbi.nlm.nih.gov/33185417/
https://pubmed.ncbi.nlm.nih.gov/?term=deep%20learning&page=148,Deeplearningmeets marine biology: Optimized fused features and LIME-driven insights for automated plankton classification.,"Hassan M, Salbitani G, Carfagna S, Khan JA.",Comput Biol Med. 2025 Jun;192(Pt A):110273. doi: 10.1016/j.compbiomed.2025.110273. Epub 2025 May 1.,https://pubmed.ncbi.nlm.nih.gov/40315719/
https://pubmed.ncbi.nlm.nih.gov/?term=deep%20learning&page=149,Heart Rate Estimation using Hermite Transform Video Magnification andDeepLearning().,"Moya-Albor E, Brieva J, Ponce H, Rivas-Scott O, Gomez-Pena C.",Annu Int Conf IEEE Eng Med Biol Soc. 2018 Jul;2018:2595-2598. doi: 10.1109/EMBC.2018.8512879.,https://pubmed.ncbi.nlm.nih.gov/30440939/
https://pubmed.ncbi.nlm.nih.gov/?term=deep%20learning&page=149,Deeplearningand differential equations for modeling changes in individual-level latent dynamics between observation periods.,"Köber G, Kalisch R, Puhlmann LMC, Chmitorz A, Schick A, Binder H.",Biom J. 2023 Aug;65(6):e2100381. doi: 10.1002/bimj.202100381. Epub 2023 Mar 17.,https://pubmed.ncbi.nlm.nih.gov/36928993/
https://pubmed.ncbi.nlm.nih.gov/?term=deep%20learning&page=149,[Adeeplearningsegmentation model for detecting caries in molar teeth].,"Zang XY, Qiao B, Meng FH, Jin NH, Hu SX, Li LB, Xing LJ, Chen F, Wang Y, Zhang HZ.",Zhonghua Yi Xue Za Zhi. 2022 Aug 30;102(32):2538-2540. doi: 10.3760/cma.j.cn112137-20220422-00895.,https://pubmed.ncbi.nlm.nih.gov/36008325/
https://pubmed.ncbi.nlm.nih.gov/?term=deep%20learning&page=149,"Cyanobacteria cell prediction using interpretabledeeplearningmodel with observed, numerical, and sensing data assemblage.","Pyo J, Cho KH, Kim K, Baek SS, Nam G, Park S.",Water Res. 2021 Sep 15;203:117483. doi: 10.1016/j.watres.2021.117483. Epub 2021 Jul 31.,https://pubmed.ncbi.nlm.nih.gov/34384949/
https://pubmed.ncbi.nlm.nih.gov/?term=deep%20learning&page=149,Expanding electrocardiogram abilities for postoperative mortality prediction withdeeplearning.,"Hong S, Zhao Q.",Lancet Digit Health. 2024 Jan;6(1):e4-e5. doi: 10.1016/S2589-7500(23)00230-3. Epub 2023 Dec 7.,https://pubmed.ncbi.nlm.nih.gov/38065779/
https://pubmed.ncbi.nlm.nih.gov/?term=deep%20learning&page=149,Deeplearning-based synthetization of real-time in-treatment 4D images using surface motion and pretreatment images: A proof-of-concept study.,"Huang Y, Dong Z, Wu H, Li C, Liu H, Zhang Y.",Med Phys. 2022 Nov;49(11):7016-7024. doi: 10.1002/mp.15858. Epub 2022 Jul 22.,https://pubmed.ncbi.nlm.nih.gov/35833590/
https://pubmed.ncbi.nlm.nih.gov/?term=deep%20learning&page=149,Usingdeeplearningto accelerate temporomandibular joint MRI at 3 T: A case report.,"Wen BH, Liu ZJ, Zhang Y, Cheng JL.",Asian J Surg. 2023 Sep;46(9):4110-4111. doi: 10.1016/j.asjsur.2023.05.111. Epub 2023 Jun 7.,https://pubmed.ncbi.nlm.nih.gov/37295988/
https://pubmed.ncbi.nlm.nih.gov/?term=deep%20learning&page=149,[Formula: see text]-Patches: A Benchmark and Evaluation of Handcrafted and Learned Local Descriptors.,"Balntas V, Lenc K, Vedaldi A, Tuytelaars T, Matas J, Mikolajczyk K.",IEEE Trans Pattern Anal Mach Intell. 2020 Nov;42(11):2825-2841. doi: 10.1109/TPAMI.2019.2915233. Epub 2019 May 10.,https://pubmed.ncbi.nlm.nih.gov/31094682/
https://pubmed.ncbi.nlm.nih.gov/?term=deep%20learning&page=149,Audio-Based Drone Detection and Identification UsingDeepLearningTechniques with Dataset Enhancement through Generative Adversarial Networks.,"Al-Emadi S, Al-Ali A, Al-Ali A.",Sensors (Basel). 2021 Jul 21;21(15):4953. doi: 10.3390/s21154953.,https://pubmed.ncbi.nlm.nih.gov/34372189/
https://pubmed.ncbi.nlm.nih.gov/?term=deep%20learning&page=149,Automated evaluation of tumor spheroid behavior in 3D culture usingdeeplearning-based recognition.,"Chen Z, Ma N, Sun X, Li Q, Zeng Y, Chen F, Sun S, Xu J, Zhang J, Ye H, Ge J, Zhang Z, Cui X, Leong K, Chen Y, Gu Z.",Biomaterials. 2021 May;272:120770. doi: 10.1016/j.biomaterials.2021.120770. Epub 2021 Mar 22.,https://pubmed.ncbi.nlm.nih.gov/33798957/
https://pubmed.ncbi.nlm.nih.gov/?term=deep%20learning&page=150,Examining otolaryngologists' attitudes towards large language models (LLMs) such as ChatGPT: a comprehensivedeeplearninganalysis.,"Praveen SV, Vijaya S.",Eur Arch Otorhinolaryngol. 2024 Feb;281(2):1061-1063. doi: 10.1007/s00405-023-08325-x. Epub 2023 Nov 13.,https://pubmed.ncbi.nlm.nih.gov/37955694/
https://pubmed.ncbi.nlm.nih.gov/?term=deep%20learning&page=150,Accelerating quantitative MR imaging with the incorporation of B(1) compensation usingdeeplearning.,"Wu Y, Ma Y, Du J, Xing L.",Magn Reson Imaging. 2020 Oct;72:78-86. doi: 10.1016/j.mri.2020.06.011. Epub 2020 Jun 29.,https://pubmed.ncbi.nlm.nih.gov/32610065/
https://pubmed.ncbi.nlm.nih.gov/?term=deep%20learning&page=150,Comparing a Large Language Model with PreviousDeepLearningModels on Named Entity Recognition of Adverse Drug Events.,"Tiffet T, Pikaar A, Trombert-Paviot B, Jaulent MC, Bousquet C.",Stud Health Technol Inform. 2024 Aug 22;316:781-785. doi: 10.3233/SHTI240528.,https://pubmed.ncbi.nlm.nih.gov/39176909/
https://pubmed.ncbi.nlm.nih.gov/?term=deep%20learning&page=150,Prediction of protein-ligand binding affinity viadeeplearningmodels.,Wang H.,Brief Bioinform. 2024 Jan 22;25(2):bbae081. doi: 10.1093/bib/bbae081.,https://pubmed.ncbi.nlm.nih.gov/38446737/
https://pubmed.ncbi.nlm.nih.gov/?term=deep%20learning&page=150,3D Animation Automatic Generation System Design Based onDeepLearning.,"Cao Y, Wan L, Shi L.",Comput Intell Neurosci. 2022 Jun 9;2022:1434599. doi: 10.1155/2022/1434599. eCollection 2022.,https://pubmed.ncbi.nlm.nih.gov/35720931/
https://pubmed.ncbi.nlm.nih.gov/?term=deep%20learning&page=150,DeepLearningand Artificial Intelligence: What Does the Cardiologist Really Need to Know?,Case JA.,Circ Cardiovasc Imaging. 2022 Sep;15(9):e014744. doi: 10.1161/CIRCIMAGING.122.014744. Epub 2022 Sep 20.,https://pubmed.ncbi.nlm.nih.gov/36126127/
https://pubmed.ncbi.nlm.nih.gov/?term=deep%20learning&page=150,A novel fast kilovoltage switching dual-energy CT withdeeplearning: Accuracy of CT number on virtual monochromatic imaging and iodine quantification.,"Kojima T, Shirasaka T, Kondo M, Kato T, Nishie A, Ishigami K, Yabuuchi H.",Phys Med. 2021 Jan;81:253-261. doi: 10.1016/j.ejmp.2020.12.018. Epub 2021 Jan 25.,https://pubmed.ncbi.nlm.nih.gov/33508738/
https://pubmed.ncbi.nlm.nih.gov/?term=deep%20learning&page=150,An End-to-EndDeepLearningApproach for State Recognition of Multifunction Radars.,"Xu X, Bi D, Pan J.",Sensors (Basel). 2022 Jul 1;22(13):4980. doi: 10.3390/s22134980.,https://pubmed.ncbi.nlm.nih.gov/35808475/
https://pubmed.ncbi.nlm.nih.gov/?term=deep%20learning&page=150,DeepLearningAdapted to Differential Neural Networks Used as Pattern Classification of Electrophysiological Signals.,"Llorente-Vidrio D, Ballesteros M, Salgado I, Chairez I.",IEEE Trans Pattern Anal Mach Intell. 2022 Sep;44(9):4807-4818. doi: 10.1109/TPAMI.2021.3066996. Epub 2022 Aug 4.,https://pubmed.ncbi.nlm.nih.gov/33735073/
https://pubmed.ncbi.nlm.nih.gov/?term=deep%20learning&page=150,Deeplearningbased HEp-2 image classification: A comprehensive review.,"Rahman S, Wang L, Sun C, Zhou L.",Med Image Anal. 2020 Oct;65:101764. doi: 10.1016/j.media.2020.101764. Epub 2020 Jul 7.,https://pubmed.ncbi.nlm.nih.gov/32745976/
https://pubmed.ncbi.nlm.nih.gov/?term=deep%20learning&page=151,DeepLearningBased Infrared Thermal Image Analysis of Complex Pavement Defect Conditions Considering Seasonal Effect.,"Chandra S, AlMansoor K, Chen C, Shi Y, Seo H.",Sensors (Basel). 2022 Dec 1;22(23):9365. doi: 10.3390/s22239365.,https://pubmed.ncbi.nlm.nih.gov/36502066/
https://pubmed.ncbi.nlm.nih.gov/?term=deep%20learning&page=151,Application ofdeeplearningin wound size measurement using fingernail as the reference.,"Chang DH, Nguyen DK, Nguyen TN, Chan CL.",BMC Med Inform Decis Mak. 2024 Dec 18;24(1):390. doi: 10.1186/s12911-024-02778-8.,https://pubmed.ncbi.nlm.nih.gov/39696347/
https://pubmed.ncbi.nlm.nih.gov/?term=deep%20learning&page=151,Recent Developments in Ultralarge and Structure-Based Virtual Screening Approaches.,Gorgulla C.,Annu Rev Biomed Data Sci. 2023 Aug 10;6:229-258. doi: 10.1146/annurev-biodatasci-020222-025013. Epub 2023 May 23.,https://pubmed.ncbi.nlm.nih.gov/37220305/
https://pubmed.ncbi.nlm.nih.gov/?term=deep%20learning&page=151,An Overview ofDeepGenerative Models in Functional and Evolutionary Genomics.,"Yelmen B, Jay F.",Annu Rev Biomed Data Sci. 2023 Aug 10;6:173-189. doi: 10.1146/annurev-biodatasci-020722-115651. Epub 2023 May 3.,https://pubmed.ncbi.nlm.nih.gov/37137168/
https://pubmed.ncbi.nlm.nih.gov/?term=deep%20learning&page=151,Disease detection on exterior surfaces of buildings usingdeeplearningin China.,"Chen Y, Li D.",Sci Rep. 2025 Mar 12;15(1):8564. doi: 10.1038/s41598-025-92112-7.,https://pubmed.ncbi.nlm.nih.gov/40074790/
https://pubmed.ncbi.nlm.nih.gov/?term=deep%20learning&page=151,A Novel Low-Bit Quantization Strategy for CompressingDeepNeural Networks.,"Long X, Zeng X, Ben Z, Zhou D, Zhang M.",Comput Intell Neurosci. 2020 Feb 18;2020:7839064. doi: 10.1155/2020/7839064. eCollection 2020.,https://pubmed.ncbi.nlm.nih.gov/32148472/
https://pubmed.ncbi.nlm.nih.gov/?term=deep%20learning&page=151,Deeplearningand cognitive science.,"Perconti P, Plebe A.",Cognition. 2020 Oct;203:104365. doi: 10.1016/j.cognition.2020.104365. Epub 2020 Jun 17.,https://pubmed.ncbi.nlm.nih.gov/32563082/
https://pubmed.ncbi.nlm.nih.gov/?term=deep%20learning&page=151,(Deep)LearningYour Left From Your Right.,Leeson P.,JACC Cardiovasc Imaging. 2020 Feb;13(2 Pt 1):382-384. doi: 10.1016/j.jcmg.2019.03.015. Epub 2019 May 15.,https://pubmed.ncbi.nlm.nih.gov/31103576/
https://pubmed.ncbi.nlm.nih.gov/?term=deep%20learning&page=151,Prediction of Aureococcus anophageffens using machinelearninganddeeplearning.,"Niu J, Lu Y, Xie M, Ou L, Cui L, Qiu H, Lu S.",Mar Pollut Bull. 2024 Mar;200:116148. doi: 10.1016/j.marpolbul.2024.116148. Epub 2024 Feb 15.,https://pubmed.ncbi.nlm.nih.gov/38364640/
https://pubmed.ncbi.nlm.nih.gov/?term=deep%20learning&page=151,Matini-Net: Versatile Material Informatics Research Framework for Feature Engineering andDeepNeural Network Design.,"Lee M, Park T, Min K.",J Chem Inf Model. 2024 Dec 9;64(23):8770-8783. doi: 10.1021/acs.jcim.4c01676. Epub 2024 Nov 21.,https://pubmed.ncbi.nlm.nih.gov/39569801/
https://pubmed.ncbi.nlm.nih.gov/?term=deep%20learning&page=152,Transforming Finance Into Vision: Concurrent Financial Time Series as Convolutional Nets.,"Dhar V, Sun C, Batra P.",Big Data. 2019 Dec;7(4):276-285. doi: 10.1089/big.2019.0139.,https://pubmed.ncbi.nlm.nih.gov/31860340/
https://pubmed.ncbi.nlm.nih.gov/?term=deep%20learning&page=152,An Olfactory Sensor Array for Predicting Chemical Odor Characteristics from Mass Spectra withDeepLearning.,"Nozaki Y, Nakamoto T.",Methods Mol Biol. 2019;2027:29-47. doi: 10.1007/978-1-4939-9616-2_3.,https://pubmed.ncbi.nlm.nih.gov/31309470/
https://pubmed.ncbi.nlm.nih.gov/?term=deep%20learning&page=152,Applyingdeeplearningto right whale photo identification.,"Bogucki R, Cygan M, Khan CB, Klimek M, Milczek JK, Mucha M.",Conserv Biol. 2019 Jun;33(3):676-684. doi: 10.1111/cobi.13226. Epub 2018 Nov 28.,https://pubmed.ncbi.nlm.nih.gov/30259577/
https://pubmed.ncbi.nlm.nih.gov/?term=deep%20learning&page=152,Custom Hardware Architectures forDeepLearningon Portable Devices: A Review.,"Zaman KS, Reaz MBI, Md Ali SH, Bakar AAA, Chowdhury MEH.",IEEE Trans Neural Netw Learn Syst. 2022 Nov;33(11):6068-6088. doi: 10.1109/TNNLS.2021.3082304. Epub 2022 Oct 27.,https://pubmed.ncbi.nlm.nih.gov/34086580/
https://pubmed.ncbi.nlm.nih.gov/?term=deep%20learning&page=152,Trends and frontiers of atmospheric duct research based on CiteSpace anddeeplearning.,"Wu J, Wei Z, Zhang J, Xu J, Jia D, Ji H.",Environ Sci Pollut Res Int. 2022 Nov;29(54):82336-82350. doi: 10.1007/s11356-022-21476-4. Epub 2022 Jun 25.,https://pubmed.ncbi.nlm.nih.gov/35751723/
https://pubmed.ncbi.nlm.nih.gov/?term=deep%20learning&page=152,Causality-inspired crop pest recognition based on Decoupled FeatureLearning.,"Hu T, Du J, Yan K, Dong W, Zhang J, Wang J, Xie C.",Pest Manag Sci. 2024 Nov;80(11):5832-5842. doi: 10.1002/ps.8314. Epub 2024 Jul 18.,https://pubmed.ncbi.nlm.nih.gov/39022822/
https://pubmed.ncbi.nlm.nih.gov/?term=deep%20learning&page=152,Angio-Net:deeplearning-based label-free detection and morphometric analysis of in vitro angiogenesis.,"Kim S, Lee J, Ko J, Park S, Lee SR, Kim Y, Lee T, Choi S, Kim J, Kim W, Chung Y, Kwon OH, Jeon NL.",Lab Chip. 2024 Feb 13;24(4):751-763. doi: 10.1039/d3lc00935a.,https://pubmed.ncbi.nlm.nih.gov/38193617/
https://pubmed.ncbi.nlm.nih.gov/?term=deep%20learning&page=152,Breast Cancer Detection and Diagnosis Using Mammographic Data: Systematic Review.,"Gardezi SJS, Elazab A, Lei B, Wang T.",J Med Internet Res. 2019 Jul 26;21(7):e14464. doi: 10.2196/14464.,https://pubmed.ncbi.nlm.nih.gov/31350843/
https://pubmed.ncbi.nlm.nih.gov/?term=deep%20learning&page=152,Application ofdeeplearningmethods: From molecular modelling to patient classification.,"Fu X, Bates PA.",Exp Cell Res. 2022 Sep 15;418(2):113278. doi: 10.1016/j.yexcr.2022.113278. Epub 2022 Jul 8.,https://pubmed.ncbi.nlm.nih.gov/35810775/
https://pubmed.ncbi.nlm.nih.gov/?term=deep%20learning&page=152,DeepGRID:DeepLearningUsing GRID Descriptors for BBB Prediction.,"Storchi L, Cruciani G, Cross S.",J Chem Inf Model. 2023 Sep 11;63(17):5496-5512. doi: 10.1021/acs.jcim.3c00768. Epub 2023 Aug 28.,https://pubmed.ncbi.nlm.nih.gov/37639536/
https://pubmed.ncbi.nlm.nih.gov/?term=deep%20learning&page=153,Comparison of Data Preprocessing Approaches for ApplyingDeepLearningto Human Activity Recognition in the Context of Industry 4.0.,"Zheng X, Wang M, Ordieres-Meré J.",Sensors (Basel). 2018 Jul 3;18(7):2146. doi: 10.3390/s18072146.,https://pubmed.ncbi.nlm.nih.gov/29970873/
https://pubmed.ncbi.nlm.nih.gov/?term=deep%20learning&page=153,Deeplearningbased searching approach for RDF graphs.,Soliman H.,PLoS One. 2020 Mar 23;15(3):e0230500. doi: 10.1371/journal.pone.0230500. eCollection 2020.,https://pubmed.ncbi.nlm.nih.gov/32203547/
https://pubmed.ncbi.nlm.nih.gov/?term=deep%20learning&page=153,CProMG: controllable protein-oriented molecule generation with desired binding affinity and drug-like properties.,"Li JN, Yang G, Zhao PC, Wei XX, Shi JY.",Bioinformatics. 2023 Jun 30;39(39 Suppl 1):i326-i336. doi: 10.1093/bioinformatics/btad222.,https://pubmed.ncbi.nlm.nih.gov/37387157/
https://pubmed.ncbi.nlm.nih.gov/?term=deep%20learning&page=153,DeAF: A multimodaldeeplearningframework for disease prediction.,"Li K, Chen C, Cao W, Wang H, Han S, Wang R, Ye Z, Wu Z, Wang W, Cai L, Ding D, Yuan Z.",Comput Biol Med. 2023 Apr;156:106715. doi: 10.1016/j.compbiomed.2023.106715. Epub 2023 Feb 28.,https://pubmed.ncbi.nlm.nih.gov/36867898/
https://pubmed.ncbi.nlm.nih.gov/?term=deep%20learning&page=153,Analysis of the Correlation between College Music Education and Public Mental Health Based onDeepLearning.,Huang J.,J Environ Public Health. 2022 Oct 5;2022:6593850. doi: 10.1155/2022/6593850. eCollection 2022.,https://pubmed.ncbi.nlm.nih.gov/36246462/
https://pubmed.ncbi.nlm.nih.gov/?term=deep%20learning&page=153,Deeplearning-based solvability of underdetermined inverse problems in medical imaging.,"Hyun CM, Baek SH, Lee M, Lee SM, Seo JK.",Med Image Anal. 2021 Apr;69:101967. doi: 10.1016/j.media.2021.101967. Epub 2021 Jan 16.,https://pubmed.ncbi.nlm.nih.gov/33517242/
https://pubmed.ncbi.nlm.nih.gov/?term=deep%20learning&page=153,Predicting Age withDeepNeural Networks from Polysomnograms.,"Brink-Kjaer A, Mignot E, Sorensen HBD, Jennum P.",Annu Int Conf IEEE Eng Med Biol Soc. 2020 Jul;2020:146-149. doi: 10.1109/EMBC44109.2020.9176254.,https://pubmed.ncbi.nlm.nih.gov/33017951/
https://pubmed.ncbi.nlm.nih.gov/?term=deep%20learning&page=153,A Data-Centric Approach to improve performance ofdeeplearningmodels.,"Bhatt N, Bhatt N, Prajapati P, Sorathiya V, Alshathri S, El-Shafai W.",Sci Rep. 2024 Sep 27;14(1):22329. doi: 10.1038/s41598-024-73643-x.,https://pubmed.ncbi.nlm.nih.gov/39333381/
https://pubmed.ncbi.nlm.nih.gov/?term=deep%20learning&page=153,A lightweightdeeplearningmodel for multi-plant biotic stress classification and detection for sustainable agriculture.,"Shafik W, Tufail A, De Silva LC, Apong RAAHM.",Sci Rep. 2025 Apr 9;15(1):12195. doi: 10.1038/s41598-025-90487-1.,https://pubmed.ncbi.nlm.nih.gov/40204810/
https://pubmed.ncbi.nlm.nih.gov/?term=deep%20learning&page=153,Translation of morphological and functional musculoskeletal imaging.,"Pedoia V, Majumdar S.",J Orthop Res. 2019 Jan;37(1):23-34. doi: 10.1002/jor.24151. Epub 2018 Oct 29.,https://pubmed.ncbi.nlm.nih.gov/30273968/
https://pubmed.ncbi.nlm.nih.gov/?term=deep%20learning&page=154,Matini-Net: Versatile Material Informatics Research Framework for Feature Engineering andDeepNeural Network Design.,"Lee M, Park T, Min K.",J Chem Inf Model. 2024 Dec 9;64(23):8770-8783. doi: 10.1021/acs.jcim.4c01676. Epub 2024 Nov 21.,https://pubmed.ncbi.nlm.nih.gov/39569801/
https://pubmed.ncbi.nlm.nih.gov/?term=deep%20learning&page=154,Disease detection on exterior surfaces of buildings usingdeeplearningin China.,"Chen Y, Li D.",Sci Rep. 2025 Mar 12;15(1):8564. doi: 10.1038/s41598-025-92112-7.,https://pubmed.ncbi.nlm.nih.gov/40074790/
https://pubmed.ncbi.nlm.nih.gov/?term=deep%20learning&page=154,Transforming Finance Into Vision: Concurrent Financial Time Series as Convolutional Nets.,"Dhar V, Sun C, Batra P.",Big Data. 2019 Dec;7(4):276-285. doi: 10.1089/big.2019.0139.,https://pubmed.ncbi.nlm.nih.gov/31860340/
https://pubmed.ncbi.nlm.nih.gov/?term=deep%20learning&page=154,A Hybrid Catheter Localisation Framework in Echocardiography Based on Electromagnetic Tracking andDeepLearningSegmentation.,"Jia F, Wang S, Pham VT.",Comput Intell Neurosci. 2022 Oct 6;2022:2119070. doi: 10.1155/2022/2119070. eCollection 2022.,https://pubmed.ncbi.nlm.nih.gov/36248919/
https://pubmed.ncbi.nlm.nih.gov/?term=deep%20learning&page=154,DeepLearningApplication in Spinal Implant Identification.,"Yang HS, Kim KR, Kim S, Park JY.",Spine (Phila Pa 1976). 2021 Mar 1;46(5):E318-E324. doi: 10.1097/BRS.0000000000003844.,https://pubmed.ncbi.nlm.nih.gov/33534442/
https://pubmed.ncbi.nlm.nih.gov/?term=deep%20learning&page=154,Applyingdeeplearningto right whale photo identification.,"Bogucki R, Cygan M, Khan CB, Klimek M, Milczek JK, Mucha M.",Conserv Biol. 2019 Jun;33(3):676-684. doi: 10.1111/cobi.13226. Epub 2018 Nov 28.,https://pubmed.ncbi.nlm.nih.gov/30259577/
https://pubmed.ncbi.nlm.nih.gov/?term=deep%20learning&page=154,Causality-inspired crop pest recognition based on Decoupled FeatureLearning.,"Hu T, Du J, Yan K, Dong W, Zhang J, Wang J, Xie C.",Pest Manag Sci. 2024 Nov;80(11):5832-5842. doi: 10.1002/ps.8314. Epub 2024 Jul 18.,https://pubmed.ncbi.nlm.nih.gov/39022822/
https://pubmed.ncbi.nlm.nih.gov/?term=deep%20learning&page=154,AutoMorph: Automated Retinal Vascular Morphology Quantification Via aDeepLearningPipeline.,"Zhou Y, Wagner SK, Chia MA, Zhao A, Woodward-Court P, Xu M, Struyven R, Alexander DC, Keane PA.",Transl Vis Sci Technol. 2022 Jul 8;11(7):12. doi: 10.1167/tvst.11.7.12.,https://pubmed.ncbi.nlm.nih.gov/35833885/
https://pubmed.ncbi.nlm.nih.gov/?term=deep%20learning&page=154,Innovations inDeepLearningto Predict Individual Risk and Treatment Outcome.,Langs G.,Radiology. 2023 Jun;307(5):e231116. doi: 10.1148/radiol.231116.,https://pubmed.ncbi.nlm.nih.gov/37278628/
https://pubmed.ncbi.nlm.nih.gov/?term=deep%20learning&page=154,An Olfactory Sensor Array for Predicting Chemical Odor Characteristics from Mass Spectra withDeepLearning.,"Nozaki Y, Nakamoto T.",Methods Mol Biol. 2019;2027:29-47. doi: 10.1007/978-1-4939-9616-2_3.,https://pubmed.ncbi.nlm.nih.gov/31309470/
https://pubmed.ncbi.nlm.nih.gov/?term=deep%20learning&page=155,Machine anddeeplearningmethods for radiomics.,"Avanzo M, Wei L, Stancanello J, Vallières M, Rao A, Morin O, Mattonen SA, El Naqa I.",Med Phys. 2020 Jun;47(5):e185-e202. doi: 10.1002/mp.13678.,https://pubmed.ncbi.nlm.nih.gov/32418336/
https://pubmed.ncbi.nlm.nih.gov/?term=deep%20learning&page=155,GenerativeDeepLearningfor Targeted Compound Design.,"Sousa T, Correia J, Pereira V, Rocha M.",J Chem Inf Model. 2021 Nov 22;61(11):5343-5361. doi: 10.1021/acs.jcim.0c01496. Epub 2021 Oct 26.,https://pubmed.ncbi.nlm.nih.gov/34699719/
