source_url,title,authors,journal_info,abstract_url
https://pubmed.ncbi.nlm.nih.gov/?term=deep%20learning&page=99,Role ofdeeplearningin infant brain MRI analysis.,"Mostapha M, Styner M.",Magn Reson Imaging. 2019 Dec;64:171-189. doi: 10.1016/j.mri.2019.06.009. Epub 2019 Jun 20.,https://pubmed.ncbi.nlm.nih.gov/31229667/
https://pubmed.ncbi.nlm.nih.gov/?term=deep%20learning&page=99,A Review ofDeepLearning-Based Contactless Heart Rate Measurement Methods.,"Ni A, Azarang A, Kehtarnavaz N.",Sensors (Basel). 2021 May 27;21(11):3719. doi: 10.3390/s21113719.,https://pubmed.ncbi.nlm.nih.gov/34071736/
https://pubmed.ncbi.nlm.nih.gov/?term=deep%20learning&page=100,Bring the model to the data: TheDeepLearningEpilepsy Detection Challenge.,Reinke A.,EBioMedicine. 2021 Apr;66:103323. doi: 10.1016/j.ebiom.2021.103323. Epub 2021 Apr 12.,https://pubmed.ncbi.nlm.nih.gov/33857902/
https://pubmed.ncbi.nlm.nih.gov/?term=deep%20learning&page=100,Multi-Signal Detection Framework: ADeepLearningBased Carrier Frequency and Bandwidth Estimation.,"Lin M, Zhang X, Tian Y, Huang Y.",Sensors (Basel). 2022 May 21;22(10):3909. doi: 10.3390/s22103909.,https://pubmed.ncbi.nlm.nih.gov/35632320/
https://pubmed.ncbi.nlm.nih.gov/?term=deep%20learning&page=100,Deeplearning-based fully automated diagnosis of melanocytic lesions by using whole slide images.,"Bao Y, Zhang J, Zhao X, Zhou H, Chen Y, Jian J, Shi T, Gao X.",J Dermatolog Treat. 2022 Aug;33(5):2571-2577. doi: 10.1080/09546634.2022.2038772. Epub 2022 Feb 10.,https://pubmed.ncbi.nlm.nih.gov/35112978/
https://pubmed.ncbi.nlm.nih.gov/?term=deep%20learning&page=100,A point cloud-baseddeeplearningstrategy for protein-ligand binding affinity prediction.,"Wang Y, Wu S, Duan Y, Huang Y.",Brief Bioinform. 2022 Jan 17;23(1):bbab474. doi: 10.1093/bib/bbab474.,https://pubmed.ncbi.nlm.nih.gov/34849569/
https://pubmed.ncbi.nlm.nih.gov/?term=deep%20learning&page=100,Editorial Comment: Accelerated Joint MRI WithDeepLearning-Based Reconstruction-A Promising Approach to Increasing Imaging Speed Without Compromising Image Quality.,Subhas N.,AJR Am J Roentgenol. 2022 Mar;218(3):516. doi: 10.2214/AJR.21.26880. Epub 2021 Sep 29.,https://pubmed.ncbi.nlm.nih.gov/34585614/
https://pubmed.ncbi.nlm.nih.gov/?term=deep%20learning&page=100,DeepLearningfor Chest Radiography in the Emergency Department.,"Munera F, Infante JC.",Radiology. 2019 Dec;293(3):581-582. doi: 10.1148/radiol.2019192079. Epub 2019 Oct 22.,https://pubmed.ncbi.nlm.nih.gov/31638859/
https://pubmed.ncbi.nlm.nih.gov/?term=deep%20learning&page=100,Next-generationdeeplearningbased on simulators and synthetic data.,"de Melo CM, Torralba A, Guibas L, DiCarlo J, Chellappa R, Hodgins J.",Trends Cogn Sci. 2022 Feb;26(2):174-187. doi: 10.1016/j.tics.2021.11.008. Epub 2021 Dec 23.,https://pubmed.ncbi.nlm.nih.gov/34955426/
https://pubmed.ncbi.nlm.nih.gov/?term=deep%20learning&page=100,Role ofdeeplearningin infant brain MRI analysis.,"Mostapha M, Styner M.",Magn Reson Imaging. 2019 Dec;64:171-189. doi: 10.1016/j.mri.2019.06.009. Epub 2019 Jun 20.,https://pubmed.ncbi.nlm.nih.gov/31229667/
https://pubmed.ncbi.nlm.nih.gov/?term=deep%20learning&page=100,Implementation and Optimization of Reverse Suspension Structure Design Model UsingDeepLearning.,"Yu X, Wang K, Wang S.",Comput Intell Neurosci. 2022 Jan 30;2022:7544113. doi: 10.1155/2022/7544113. eCollection 2022.,https://pubmed.ncbi.nlm.nih.gov/35140777/
https://pubmed.ncbi.nlm.nih.gov/?term=deep%20learning&page=100,Surrogate Simulation of Subject-Specific Lateral Pinch viaDeepLearning.,"Lindbeck EM, Diaz MT, Nichols JA, Harley JB.",Annu Int Conf IEEE Eng Med Biol Soc. 2024 Jul;2024:1-4. doi: 10.1109/EMBC53108.2024.10782182.,https://pubmed.ncbi.nlm.nih.gov/40039080/
https://pubmed.ncbi.nlm.nih.gov/?term=deep%20learning&page=101,Class-Aware Fish Species Recognition UsingDeepLearningfor an Imbalanced Dataset.,"Alaba SY, Nabi MM, Shah C, Prior J, Campbell MD, Wallace F, Ball JE, Moorhead R.",Sensors (Basel). 2022 Oct 28;22(21):8268. doi: 10.3390/s22218268.,https://pubmed.ncbi.nlm.nih.gov/36365964/
https://pubmed.ncbi.nlm.nih.gov/?term=deep%20learning&page=101,Convolutional Neural Networks for Radiologic Images: A Radiologist's Guide.,"Soffer S, Ben-Cohen A, Shimon O, Amitai MM, Greenspan H, Klang E.",Radiology. 2019 Mar;290(3):590-606. doi: 10.1148/radiol.2018180547. Epub 2019 Jan 29.,https://pubmed.ncbi.nlm.nih.gov/30694159/
https://pubmed.ncbi.nlm.nih.gov/?term=deep%20learning&page=101,Deeplearningimage transmission through a multimode fiber based on a small training dataset.,"Song B, Jin C, Wu J, Lin W, Liu B, Huang W, Chen S.",Opt Express. 2022 Feb 14;30(4):5657-5672. doi: 10.1364/OE.450999.,https://pubmed.ncbi.nlm.nih.gov/35209523/
https://pubmed.ncbi.nlm.nih.gov/?term=deep%20learning&page=101,An Ensemble ofDeepLearningFrameworks for Predicting Respiratory Anomalies.,"Pham L, Ngo D, Tran K, Hoang T, Schindler A, McLoughlin I.",Annu Int Conf IEEE Eng Med Biol Soc. 2022 Jul;2022:4595-4598. doi: 10.1109/EMBC48229.2022.9871440.,https://pubmed.ncbi.nlm.nih.gov/36086440/
https://pubmed.ncbi.nlm.nih.gov/?term=deep%20learning&page=101,Towards accelerating model parallelism in distributeddeeplearningsystems.,"Choi H, Lee BH, Chun SY, Lee J.",PLoS One. 2023 Nov 2;18(11):e0293338. doi: 10.1371/journal.pone.0293338. eCollection 2023.,https://pubmed.ncbi.nlm.nih.gov/37917655/
https://pubmed.ncbi.nlm.nih.gov/?term=deep%20learning&page=101,Rock Crack Recognition Technology Based onDeepLearning.,"Li J, Tian Y, Chen J, Wang H.",Sensors (Basel). 2023 Jun 8;23(12):5421. doi: 10.3390/s23125421.,https://pubmed.ncbi.nlm.nih.gov/37420588/
https://pubmed.ncbi.nlm.nih.gov/?term=deep%20learning&page=101,Deeplearning-based quasi-continuum theory for structure of confined fluids.,"Wu H, Aluru NR.",J Chem Phys. 2022 Aug 28;157(8):084121. doi: 10.1063/5.0096481.,https://pubmed.ncbi.nlm.nih.gov/36049999/
https://pubmed.ncbi.nlm.nih.gov/?term=deep%20learning&page=101,Interaction prediction in structure-based virtual screening usingdeeplearning.,"Gonczarek A, Tomczak JM, Zaręba S, Kaczmar J, Dąbrowski P, Walczak MJ.",Comput Biol Med. 2018 Sep 1;100:253-258. doi: 10.1016/j.compbiomed.2017.09.007. Epub 2017 Sep 14.,https://pubmed.ncbi.nlm.nih.gov/28941550/
https://pubmed.ncbi.nlm.nih.gov/?term=deep%20learning&page=101,"Deeplearning, reinforcementlearning, and world models.","Matsuo Y, LeCun Y, Sahani M, Precup D, Silver D, Sugiyama M, Uchibe E, Morimoto J.",Neural Netw. 2022 Aug;152:267-275. doi: 10.1016/j.neunet.2022.03.037. Epub 2022 Apr 19.,https://pubmed.ncbi.nlm.nih.gov/35569196/
https://pubmed.ncbi.nlm.nih.gov/?term=deep%20learning&page=101,Errata: Automatic Detection of Left Ventricular Dilatation and Hypertrophy from Electrocardiograms UsingDeepLearning.,[No authors listed],Int Heart J. 2022;63(6):1218. doi: 10.1536/ihj.63-6_Errata.,https://pubmed.ncbi.nlm.nih.gov/36450562/
https://pubmed.ncbi.nlm.nih.gov/?term=deep%20learning&page=102,A multimodaldeeplearningframework for predicting drug-drug interaction events.,"Deng Y, Xu X, Qiu Y, Xia J, Zhang W, Liu S.",Bioinformatics. 2020 Aug 1;36(15):4316-4322. doi: 10.1093/bioinformatics/btaa501.,https://pubmed.ncbi.nlm.nih.gov/32407508/
https://pubmed.ncbi.nlm.nih.gov/?term=deep%20learning&page=102,An integrated framework ofdeeplearningand entropy theory for enhanced high-dimensional permeability field identification in heterogeneous aquifers.,"Cao M, Dai Z, Chen J, Yin H, Zhang X, Wu J, Thanh HV, Soltanian MR.",Water Res. 2025 Jan 1;268(Pt B):122706. doi: 10.1016/j.watres.2024.122706. Epub 2024 Oct 30.,https://pubmed.ncbi.nlm.nih.gov/39515243/
https://pubmed.ncbi.nlm.nih.gov/?term=deep%20learning&page=102,Exploring the Effects of Ionic Defects on the Stability of CsPbI(3) with aDeepLearningPotential.,"Yang W, Li J, Chen X, Feng Y, Wu C, Gates ID, Gao Z, Ding X, Yao J, Li H.",Chemphyschem. 2022 Apr 5;23(7):e202100841. doi: 10.1002/cphc.202100841. Epub 2022 Feb 23.,https://pubmed.ncbi.nlm.nih.gov/35199438/
https://pubmed.ncbi.nlm.nih.gov/?term=deep%20learning&page=102,Survey ondeeplearningfor pulmonary medical imaging.,"Ma J, Song Y, Tian X, Hua Y, Zhang R, Wu J.",Front Med. 2020 Aug;14(4):450-469. doi: 10.1007/s11684-019-0726-4. Epub 2019 Dec 16.,https://pubmed.ncbi.nlm.nih.gov/31840200/
https://pubmed.ncbi.nlm.nih.gov/?term=deep%20learning&page=102,Practical Applications ofDeepLearningTo Impute Heterogeneous Drug Discovery Data.,"Irwin BWJ, Levell JR, Whitehead TM, Segall MD, Conduit GJ.",J Chem Inf Model. 2020 Jun 22;60(6):2848-2857. doi: 10.1021/acs.jcim.0c00443. Epub 2020 Jun 10.,https://pubmed.ncbi.nlm.nih.gov/32478517/
https://pubmed.ncbi.nlm.nih.gov/?term=deep%20learning&page=102,Using traditional machinelearninganddeeplearningmethods for on- and off-target prediction in CRISPR/Cas9: a review.,"Sherkatghanad Z, Abdar M, Charlier J, Makarenkov V.",Brief Bioinform. 2023 May 19;24(3):bbad131. doi: 10.1093/bib/bbad131.,https://pubmed.ncbi.nlm.nih.gov/37080758/
https://pubmed.ncbi.nlm.nih.gov/?term=deep%20learning&page=102,Predicting financial losses due to apartment construction accidents utilizingdeeplearningtechniques.,"Kim JM, Bae J, Park H, Yum SG.",Sci Rep. 2022 Mar 30;12(1):5365. doi: 10.1038/s41598-022-09453-w.,https://pubmed.ncbi.nlm.nih.gov/35354904/
https://pubmed.ncbi.nlm.nih.gov/?term=deep%20learning&page=102,Index Evaluation of Different Hospital Management Modes Based onDeepLearningModel.,"Li J, Wang Y.",Comput Intell Neurosci. 2022 Apr 27;2022:8507288. doi: 10.1155/2022/8507288. eCollection 2022.,https://pubmed.ncbi.nlm.nih.gov/35528337/
https://pubmed.ncbi.nlm.nih.gov/?term=deep%20learning&page=102,Research on Classification of Fine-Grained Rock Images Based onDeepLearning.,"Liang Y, Cui Q, Luo X, Xie Z.",Comput Intell Neurosci. 2021 Sep 20;2021:5779740. doi: 10.1155/2021/5779740. eCollection 2021.,https://pubmed.ncbi.nlm.nih.gov/34594372/
https://pubmed.ncbi.nlm.nih.gov/?term=deep%20learning&page=102,Deeplearningfor drug-drug interaction extraction from the literature: a review.,"Zhang T, Leng J, Liu Y.",Brief Bioinform. 2020 Sep 25;21(5):1609-1627. doi: 10.1093/bib/bbz087.,https://pubmed.ncbi.nlm.nih.gov/31686105/
https://pubmed.ncbi.nlm.nih.gov/?term=deep%20learning&page=103,A comprehensive survey ofdeeplearningresearch on medical image analysis with focus on transferlearning.,"Atasever S, Azginoglu N, Terzi DS, Terzi R.",Clin Imaging. 2023 Feb;94:18-41. doi: 10.1016/j.clinimag.2022.11.003. Epub 2022 Nov 12.,https://pubmed.ncbi.nlm.nih.gov/36462229/
https://pubmed.ncbi.nlm.nih.gov/?term=deep%20learning&page=103,"Physics-InformedDeep-LearningFor Elasticity: Forward, Inverse, and Mixed Problems.","Chen CT, Gu GX.",Adv Sci (Weinh). 2023 Jun;10(18):e2300439. doi: 10.1002/advs.202300439. Epub 2023 Apr 24.,https://pubmed.ncbi.nlm.nih.gov/37092567/
https://pubmed.ncbi.nlm.nih.gov/?term=deep%20learning&page=103,The Construction of English Smart Classroom Teaching Mode Based onDeepLearning.,"Niu J, Liu Y.",Comput Intell Neurosci. 2022 Aug 22;2022:9037010. doi: 10.1155/2022/9037010. eCollection 2022.,https://pubmed.ncbi.nlm.nih.gov/36045993/
https://pubmed.ncbi.nlm.nih.gov/?term=deep%20learning&page=103,Visual Detection and Image Processing of Parking Space Based onDeepLearning.,"Huang C, Yang S, Luo Y, Wang Y, Liu Z.",Sensors (Basel). 2022 Sep 3;22(17):6672. doi: 10.3390/s22176672.,https://pubmed.ncbi.nlm.nih.gov/36081130/
https://pubmed.ncbi.nlm.nih.gov/?term=deep%20learning&page=103,Integration of pre-trained protein language models into geometricdeeplearningnetworks.,"Wu F, Wu L, Radev D, Xu J, Li SZ.",Commun Biol. 2023 Aug 25;6(1):876. doi: 10.1038/s42003-023-05133-1.,https://pubmed.ncbi.nlm.nih.gov/37626165/
https://pubmed.ncbi.nlm.nih.gov/?term=deep%20learning&page=103,Application of error level analysis in image spam classification usingdeeplearningmodel.,"Singh AB, Singh KM.",PLoS One. 2023 Dec 14;18(12):e0291037. doi: 10.1371/journal.pone.0291037. eCollection 2023.,https://pubmed.ncbi.nlm.nih.gov/38096218/
https://pubmed.ncbi.nlm.nih.gov/?term=deep%20learning&page=103,[Review on Applications ofDeepLearningin Digital Pathological Images].,"Lyu C, Xie Y, Qiu L, Zhao L, Zhao J.",Zhongguo Yi Liao Qi Xie Za Zhi. 2025 May 30;49(3):237-243. doi: 10.12455/j.issn.1671-7104.240499.,https://pubmed.ncbi.nlm.nih.gov/40574431/
https://pubmed.ncbi.nlm.nih.gov/?term=deep%20learning&page=103,Multi-domain and complex protein structure prediction using inter-domain interactions fromdeeplearning.,"Xia Y, Zhao K, Liu D, Zhou X, Zhang G.",Commun Biol. 2023 Dec 1;6(1):1221. doi: 10.1038/s42003-023-05610-7.,https://pubmed.ncbi.nlm.nih.gov/38040847/
https://pubmed.ncbi.nlm.nih.gov/?term=deep%20learning&page=103,Randomness assisted in-line holography withdeeplearning.,"Manisha, Mandal AC, Rathor M, Zalevsky Z, Singh RK.",Sci Rep. 2023 Jul 7;13(1):10986. doi: 10.1038/s41598-023-37810-w.,https://pubmed.ncbi.nlm.nih.gov/37419990/
https://pubmed.ncbi.nlm.nih.gov/?term=deep%20learning&page=103,EfficientDeepLearning-based Wound-bed Segmentation For Mobile Applications.,"Ong EP, Tang Ka Yin C, Lee BH.",Annu Int Conf IEEE Eng Med Biol Soc. 2020 Jul;2020:1654-1657. doi: 10.1109/EMBC44109.2020.9176299.,https://pubmed.ncbi.nlm.nih.gov/33018313/
https://pubmed.ncbi.nlm.nih.gov/?term=deep%20learning&page=104,A Novel Hybrid Multi-ModalDeepLearningfor Detecting Hashtag Incongruity on Social Media.,"Dadgar S, Neshat M.",Sensors (Basel). 2022 Dec 15;22(24):9870. doi: 10.3390/s22249870.,https://pubmed.ncbi.nlm.nih.gov/36560237/
https://pubmed.ncbi.nlm.nih.gov/?term=deep%20learning&page=104,Application of adeeplearning-based image analysis and live-cell imaging system for quantifying adipogenic differentiation kinetics of adipose-derived stem/stromal cells.,"Brooks PT, Munthe-Fog L, Rieneck K, Banch Clausen F, Rivera OB, Kannik Haastrup E, Fischer-Nielsen A, Svalgaard JD.",Adipocyte. 2021 Dec;10(1):621-630. doi: 10.1080/21623945.2021.2000696.,https://pubmed.ncbi.nlm.nih.gov/34747303/
https://pubmed.ncbi.nlm.nih.gov/?term=deep%20learning&page=104,Performance ofDeepLearningin the Interpretation of Serum Protein Electrophoresis.,"He H, Wang L, Wang X, Sun W, Zhang M.",Clin Chem. 2022 Oct 6;68(10):1340-1341. doi: 10.1093/clinchem/hvac144.,https://pubmed.ncbi.nlm.nih.gov/36107973/
https://pubmed.ncbi.nlm.nih.gov/?term=deep%20learning&page=104,"Artificial intelligence, machinelearning, anddeeplearningin orthopedic surgery.",Atik OŞ.,Jt Dis Relat Surg. 2022;33(2):484-485. doi: 10.52312/jdrs.2022.57906.,https://pubmed.ncbi.nlm.nih.gov/35852212/
https://pubmed.ncbi.nlm.nih.gov/?term=deep%20learning&page=104,Designing all-pay auctions usingdeeplearningand multi-agent simulation.,"Gemp I, Anthony T, Kramar J, Eccles T, Tacchetti A, Bachrach Y.",Sci Rep. 2022 Oct 8;12(1):16937. doi: 10.1038/s41598-022-20234-3.,https://pubmed.ncbi.nlm.nih.gov/36209288/
https://pubmed.ncbi.nlm.nih.gov/?term=deep%20learning&page=104,A roadmap for multi-omics data integration usingdeeplearning.,"Kang M, Ko E, Mersha TB.",Brief Bioinform. 2022 Jan 17;23(1):bbab454. doi: 10.1093/bib/bbab454.,https://pubmed.ncbi.nlm.nih.gov/34791014/
https://pubmed.ncbi.nlm.nih.gov/?term=deep%20learning&page=104,Accurate classification of membrane protein types based on sequence and evolutionary information usingdeeplearning.,"Guo L, Wang S, Li M, Cao Z.",BMC Bioinformatics. 2019 Dec 24;20(Suppl 25):700. doi: 10.1186/s12859-019-3275-6.,https://pubmed.ncbi.nlm.nih.gov/31874615/
https://pubmed.ncbi.nlm.nih.gov/?term=deep%20learning&page=104,Deeplearningfor chest X-ray analysis: A survey.,"Çallı E, Sogancioglu E, van Ginneken B, van Leeuwen KG, Murphy K.",Med Image Anal. 2021 Aug;72:102125. doi: 10.1016/j.media.2021.102125. Epub 2021 Jun 5.,https://pubmed.ncbi.nlm.nih.gov/34171622/
https://pubmed.ncbi.nlm.nih.gov/?term=deep%20learning&page=104,"Machinelearning,deeplearningand hernia surgery. Are we pushing the limits of abdominal core health? A qualitative systematic review.","Lima DL, Kasakewitch J, Nguyen DQ, Nogueira R, Cavazzola LT, Heniford BT, Malcher F.",Hernia. 2024 Aug;28(4):1405-1412. doi: 10.1007/s10029-024-03069-x. Epub 2024 May 18.,https://pubmed.ncbi.nlm.nih.gov/38761300/
https://pubmed.ncbi.nlm.nih.gov/?term=deep%20learning&page=104,"Machine andDeepLearningtowards COVID-19 Diagnosis and Treatment: Survey, Challenges, and Future Directions.","Alafif T, Tehame AM, Bajaba S, Barnawi A, Zia S.",Int J Environ Res Public Health. 2021 Jan 27;18(3):1117. doi: 10.3390/ijerph18031117.,https://pubmed.ncbi.nlm.nih.gov/33513984/
https://pubmed.ncbi.nlm.nih.gov/?term=deep%20learning&page=105,BIONIC: discovering new biology throughdeeplearning-based network integration.,[No authors listed],Nat Methods. 2022 Oct;19(10):1185-1186. doi: 10.1038/s41592-022-01617-w.,https://pubmed.ncbi.nlm.nih.gov/36192466/
https://pubmed.ncbi.nlm.nih.gov/?term=deep%20learning&page=105,DeepLearningfor Time Series Forecasting: A Survey.,"Torres JF, Hadjout D, Sebaa A, Martínez-Álvarez F, Troncoso A.",Big Data. 2021 Feb;9(1):3-21. doi: 10.1089/big.2020.0159. Epub 2020 Dec 3.,https://pubmed.ncbi.nlm.nih.gov/33275484/
https://pubmed.ncbi.nlm.nih.gov/?term=deep%20learning&page=105,Noveldeeplearningradiomics model for preoperative evaluation of hepatocellular carcinoma differentiation based on computed tomography data.,"Ding Y, Ruan S, Wang Y, Shao J, Sun R, Tian W, Xiang N, Ge W, Zhang X, Su K, Xia J, Huang Q, Liu W, Sun Q, Dong H, Farias MCQ, Guo T, Krylov AS, Liang W, Xiao W, Bai X, Liang T.",Clin Transl Med. 2021 Nov;11(11):e570. doi: 10.1002/ctm2.570.,https://pubmed.ncbi.nlm.nih.gov/34841694/
https://pubmed.ncbi.nlm.nih.gov/?term=deep%20learning&page=105,Texture Image Classification Based onDeepLearningand Wireless Sensor Technology.,"Chen F, Qi J, Li X.",Comput Intell Neurosci. 2022 May 24;2022:1761635. doi: 10.1155/2022/1761635. eCollection 2022.,https://pubmed.ncbi.nlm.nih.gov/35655490/
https://pubmed.ncbi.nlm.nih.gov/?term=deep%20learning&page=105,Deep-learningmodel associating lateral cervical radiographic features with Cormack-Lehane grade 3 or 4 glottic view.,"Cho HY, Lee K, Kong HJ, Yang HL, Jung CW, Park HP, Hwang JY, Lee HC.",Anaesthesia. 2023 Jan;78(1):64-72. doi: 10.1111/anae.15874. Epub 2022 Oct 5.,https://pubmed.ncbi.nlm.nih.gov/36198200/
https://pubmed.ncbi.nlm.nih.gov/?term=deep%20learning&page=105,Implementation ofDeep-Learning-Based CSI Feedback Reporting on 5G NR-Compliant Link-Level Simulator.,"Riviello DG, Tuninato R, Zimaglia E, Fantini R, Garello R.",Sensors (Basel). 2023 Jan 12;23(2):910. doi: 10.3390/s23020910.,https://pubmed.ncbi.nlm.nih.gov/36679708/
https://pubmed.ncbi.nlm.nih.gov/?term=deep%20learning&page=105,Recognizing Occlusal Caries in Dental Intraoral Images UsingDeepLearning.,"Moutselos K, Berdouses E, Oulis C, Maglogiannis I.",Annu Int Conf IEEE Eng Med Biol Soc. 2019 Jul;2019:1617-1620. doi: 10.1109/EMBC.2019.8856553.,https://pubmed.ncbi.nlm.nih.gov/31946206/
https://pubmed.ncbi.nlm.nih.gov/?term=deep%20learning&page=105,Yuel: Improving the Generalizability of Structure-Free Compound-Protein Interaction Prediction.,"Wang J, Dokholyan NV.",J Chem Inf Model. 2022 Feb 14;62(3):463-471. doi: 10.1021/acs.jcim.1c01531. Epub 2022 Feb 1.,https://pubmed.ncbi.nlm.nih.gov/35103472/
https://pubmed.ncbi.nlm.nih.gov/?term=deep%20learning&page=105,Hologram classification of occluded and deformable objects with speckle noise contamination bydeeplearning.,"Lam HHS, Tsang PWM, Poon TC.",J Opt Soc Am A Opt Image Sci Vis. 2022 Mar 1;39(3):411-417. doi: 10.1364/JOSAA.444648.,https://pubmed.ncbi.nlm.nih.gov/35297424/
https://pubmed.ncbi.nlm.nih.gov/?term=deep%20learning&page=105,An Intelligent Prediction for Sports Industry Scale Based on Time Series Algorithm andDeepLearning.,Liang H.,Comput Intell Neurosci. 2022 Jun 24;2022:9649825. doi: 10.1155/2022/9649825. eCollection 2022.,https://pubmed.ncbi.nlm.nih.gov/35785050/
https://pubmed.ncbi.nlm.nih.gov/?term=deep%20learning&page=106,A Novel Hybrid Multi-ModalDeepLearningfor Detecting Hashtag Incongruity on Social Media.,"Dadgar S, Neshat M.",Sensors (Basel). 2022 Dec 15;22(24):9870. doi: 10.3390/s22249870.,https://pubmed.ncbi.nlm.nih.gov/36560237/
https://pubmed.ncbi.nlm.nih.gov/?term=deep%20learning&page=106,A Novel Forecasting Approach by the GA-SVR-GRNN HybridDeepLearningAlgorithm for Oil Future Prices.,"Wang L, Xia Y, Lu Y.",Comput Intell Neurosci. 2022 Aug 21;2022:4952215. doi: 10.1155/2022/4952215. eCollection 2022.,https://pubmed.ncbi.nlm.nih.gov/36045986/
https://pubmed.ncbi.nlm.nih.gov/?term=deep%20learning&page=106,Yuel: Improving the Generalizability of Structure-Free Compound-Protein Interaction Prediction.,"Wang J, Dokholyan NV.",J Chem Inf Model. 2022 Feb 14;62(3):463-471. doi: 10.1021/acs.jcim.1c01531. Epub 2022 Feb 1.,https://pubmed.ncbi.nlm.nih.gov/35103472/
https://pubmed.ncbi.nlm.nih.gov/?term=deep%20learning&page=106,Improving the enzymatic activity and stability of N-carbamoyl hydrolase usingdeeplearningapproach.,"Zhang F, Naeem M, Yu B, Liu F, Ju J.",Microb Cell Fact. 2024 Jun 4;23(1):164. doi: 10.1186/s12934-024-02439-5.,https://pubmed.ncbi.nlm.nih.gov/38834993/
https://pubmed.ncbi.nlm.nih.gov/?term=deep%20learning&page=106,Hologram classification of occluded and deformable objects with speckle noise contamination bydeeplearning.,"Lam HHS, Tsang PWM, Poon TC.",J Opt Soc Am A Opt Image Sci Vis. 2022 Mar 1;39(3):411-417. doi: 10.1364/JOSAA.444648.,https://pubmed.ncbi.nlm.nih.gov/35297424/
https://pubmed.ncbi.nlm.nih.gov/?term=deep%20learning&page=106,Deeplearningidentifies and quantifies recombination hotspot determinants.,"Li Y, Chen S, Rapakoulia T, Kuwahara H, Yip KY, Gao X.",Bioinformatics. 2022 May 13;38(10):2683-2691. doi: 10.1093/bioinformatics/btac234.,https://pubmed.ncbi.nlm.nih.gov/35561158/
https://pubmed.ncbi.nlm.nih.gov/?term=deep%20learning&page=106,DeepCollocativeLearningfor Immunofixation Electrophoresis Image Analysis.,"Wei XY, Yang ZQ, Zhang XL, Liao G, Sheng AL, Zhou SK, Wu Y, Du L.",IEEE Trans Med Imaging. 2021 Jul;40(7):1898-1910. doi: 10.1109/TMI.2021.3068404. Epub 2021 Jun 30.,https://pubmed.ncbi.nlm.nih.gov/33760732/
https://pubmed.ncbi.nlm.nih.gov/?term=deep%20learning&page=106,Taylor-Gorilla troops optimizeddeeplearningnetwork for surface roughness estimation.,"Badashah SJ, Basha SS, Ahamed SR, Subba Rao SPV, Janardhan Raju M, Mallikarjun M.",Network. 2023 Feb-Nov;34(4):221-249. doi: 10.1080/0954898X.2023.2237587. Epub 2023 Aug 22.,https://pubmed.ncbi.nlm.nih.gov/37606050/
https://pubmed.ncbi.nlm.nih.gov/?term=deep%20learning&page=106,BIONIC: discovering new biology throughdeeplearning-based network integration.,[No authors listed],Nat Methods. 2022 Oct;19(10):1185-1186. doi: 10.1038/s41592-022-01617-w.,https://pubmed.ncbi.nlm.nih.gov/36192466/
https://pubmed.ncbi.nlm.nih.gov/?term=deep%20learning&page=106,DeepLearningfor Time Series Forecasting: A Survey.,"Torres JF, Hadjout D, Sebaa A, Martínez-Álvarez F, Troncoso A.",Big Data. 2021 Feb;9(1):3-21. doi: 10.1089/big.2020.0159. Epub 2020 Dec 3.,https://pubmed.ncbi.nlm.nih.gov/33275484/
https://pubmed.ncbi.nlm.nih.gov/?term=deep%20learning&page=107,DeepFrag-k: a fragment-baseddeeplearningapproach for protein fold recognition.,"Elhefnawy W, Li M, Wang J, Li Y.",BMC Bioinformatics. 2020 Nov 18;21(Suppl 6):203. doi: 10.1186/s12859-020-3504-z.,https://pubmed.ncbi.nlm.nih.gov/33203392/
https://pubmed.ncbi.nlm.nih.gov/?term=deep%20learning&page=107,Domain Adaptive Hand Pose Estimation Based on Self-Looping Adversarial Training Strategy.,"Jin R, Yang J.",Sensors (Basel). 2022 Nov 15;22(22):8843. doi: 10.3390/s22228843.,https://pubmed.ncbi.nlm.nih.gov/36433440/
https://pubmed.ncbi.nlm.nih.gov/?term=deep%20learning&page=107,DeepEHR: A Survey of Recent Advances inDeepLearningTechniques for Electronic Health Record (EHR) Analysis.,"Shickel B, Tighe PJ, Bihorac A, Rashidi P.",IEEE J Biomed Health Inform. 2018 Sep;22(5):1589-1604. doi: 10.1109/JBHI.2017.2767063. Epub 2017 Oct 27.,https://pubmed.ncbi.nlm.nih.gov/29989977/
https://pubmed.ncbi.nlm.nih.gov/?term=deep%20learning&page=107,Texture Image Classification Based onDeepLearningand Wireless Sensor Technology.,"Chen F, Qi J, Li X.",Comput Intell Neurosci. 2022 May 24;2022:1761635. doi: 10.1155/2022/1761635. eCollection 2022.,https://pubmed.ncbi.nlm.nih.gov/35655490/
https://pubmed.ncbi.nlm.nih.gov/?term=deep%20learning&page=107,Deep-learningmodel associating lateral cervical radiographic features with Cormack-Lehane grade 3 or 4 glottic view.,"Cho HY, Lee K, Kong HJ, Yang HL, Jung CW, Park HP, Hwang JY, Lee HC.",Anaesthesia. 2023 Jan;78(1):64-72. doi: 10.1111/anae.15874. Epub 2022 Oct 5.,https://pubmed.ncbi.nlm.nih.gov/36198200/
https://pubmed.ncbi.nlm.nih.gov/?term=deep%20learning&page=107,Balancing Data onDeepLearning-Based Proteochemometric Activity Classification.,"Lopez-Del Rio A, Picart-Armada S, Perera-Lluna A.",J Chem Inf Model. 2021 Apr 26;61(4):1657-1669. doi: 10.1021/acs.jcim.1c00086. Epub 2021 Mar 29.,https://pubmed.ncbi.nlm.nih.gov/33779173/
https://pubmed.ncbi.nlm.nih.gov/?term=deep%20learning&page=107,DeepLearningfor Neuroimaging Segmentation with a Novel Data Augmentation Strategy.,"Wu W, Lu Y, Mane R, Guan C.",Annu Int Conf IEEE Eng Med Biol Soc. 2020 Jul;2020:1516-1519. doi: 10.1109/EMBC44109.2020.9176537.,https://pubmed.ncbi.nlm.nih.gov/33018279/
https://pubmed.ncbi.nlm.nih.gov/?term=deep%20learning&page=107,GeoBind: segmentation of nucleic acid binding interface on protein surface with geometricdeeplearning.,"Li P, Liu ZP.",Nucleic Acids Res. 2023 Jun 9;51(10):e60. doi: 10.1093/nar/gkad288.,https://pubmed.ncbi.nlm.nih.gov/37070217/
https://pubmed.ncbi.nlm.nih.gov/?term=deep%20learning&page=107,Protein-Protein Interface Topology as a Predictor of Secondary Structure and Molecular Function Using ConvolutionalDeepLearning.,Bouvier B.,J Chem Inf Model. 2021 Jul 26;61(7):3292-3303. doi: 10.1021/acs.jcim.1c00644. Epub 2021 Jul 6.,https://pubmed.ncbi.nlm.nih.gov/34225449/
